ID,URL,Title
12876,https://svs.gsfc.nasa.gov/12876/,"For 15 Years, GRACE Tracked Freshwater Movements Around the World"
12878,https://svs.gsfc.nasa.gov/12878/,Jupiter's Great Red Spot Shrinks and Grows
12879,https://svs.gsfc.nasa.gov/12879/,NASA Studies an Unusual Arctic Warming Event
12880,https://svs.gsfc.nasa.gov/12880/,Cosmic Designs and The Planets
12881,https://svs.gsfc.nasa.gov/12881/,Webb Telescope Move from NASA's Johnson Space Center to Northrop Grumman Time-Lapses
12882,https://svs.gsfc.nasa.gov/12882/,Send Your Name to the Sun with Parker Solar Probe
12883,https://svs.gsfc.nasa.gov/12883/,TESS Arrives at KSC
12884,https://svs.gsfc.nasa.gov/12884/,TESS Shorts
12885,https://svs.gsfc.nasa.gov/12885/,TESS-Kepler Field-of-View Animation
12886,https://svs.gsfc.nasa.gov/12886/,TESS Social Media Products
12887,https://svs.gsfc.nasa.gov/12887/,TESS Coverage Animations
12889,https://svs.gsfc.nasa.gov/12889/,Mission Possible: Women of the Hubble Space Telescope
12890,https://svs.gsfc.nasa.gov/12890/,Solar Highlights of 2018
12892,https://svs.gsfc.nasa.gov/12892/,TESS Solar Array Deploy
12893,https://svs.gsfc.nasa.gov/12893/,Hubble's Messier Marathon Madness
12894,https://svs.gsfc.nasa.gov/12894/,Webb Telescope Rolled out of Chamber A Time-Lapse
12895,https://svs.gsfc.nasa.gov/12895/,Alignment of the Primary Mirror Segments of The James Webb Space Telescope
12896,https://svs.gsfc.nasa.gov/12896/,Webb Unpacked and Mounted in Northrop Grumman's Cleanroom
12897,https://svs.gsfc.nasa.gov/12897/,New NASA Model Finds Landslide Threats in Near Real-Time During Heavy Rains
12898,https://svs.gsfc.nasa.gov/12898/,Arctic Sea Ice Continues a Trend of Shrinking Maximum Extents
12899,https://svs.gsfc.nasa.gov/12899/,Send Your Name to the Sun
12900,https://svs.gsfc.nasa.gov/12900/,Insights on Comet Tails Are Blowing in the Solar Wind
12901,https://svs.gsfc.nasa.gov/12901/,NASA Spacecraft Finds New Magnetic Process in Turbulent Space
12902,https://svs.gsfc.nasa.gov/12902/,The Secrets behind Earth’s Multi-colored Glow
12903,https://svs.gsfc.nasa.gov/12903/,Discovering the Sun’s Mysteriously Hot Atmosphere
12904,https://svs.gsfc.nasa.gov/12904/,Operation IceBridge: What (and Who) it Takes to Keep a Mission Flying
12905,https://svs.gsfc.nasa.gov/12905/,The 88-South Antarctic Traverse
12906,https://svs.gsfc.nasa.gov/12906/,Two New Satellites Set to Study One of Earth's Most Critically Changing Regions
12907,https://svs.gsfc.nasa.gov/12907/,Hubble Views a Galaxy Lacking Dark Matter
12908,https://svs.gsfc.nasa.gov/12908/,Scientists Create First-Ever 3D Model of a Melting Snowflake
12909,https://svs.gsfc.nasa.gov/12909/,James Webb Space Telescope Update B-Roll
12910,https://svs.gsfc.nasa.gov/12910/,ICON Launch Sequence
12911,https://svs.gsfc.nasa.gov/12911/,Parker Solar Probe Trailer
12913,https://svs.gsfc.nasa.gov/12913/,NASA Preparing to Launch New Planet-Hunting Mission Live Shots
12915,https://svs.gsfc.nasa.gov/12915/,"Hubble Space Telescope Celebrates 28 Years: Live Interviews on April 20, 2018"
12916,https://svs.gsfc.nasa.gov/12916/,50th Anniversary of NASA's OAO 2 Mission
12917,https://svs.gsfc.nasa.gov/12917/,Parker Solar Probe Travels to Florida
12927,https://svs.gsfc.nasa.gov/12927/,Looking at the Corona with WISPR on Parker Solar Probe
12928,https://svs.gsfc.nasa.gov/12928/,How to View and Share Your Planet with Worldview
12929,https://svs.gsfc.nasa.gov/12929/,NASA Celebrates Earth Day and the Amazing Tech that Makes Earth Exploration Possible
12931,https://svs.gsfc.nasa.gov/12931/,Hubble Technology Finds Earthly Applications
12932,https://svs.gsfc.nasa.gov/12932/,Using Earth to Understand How Water May Have Affected Volcanoes on Mars
12933,https://svs.gsfc.nasa.gov/12933/,TESS Launch Footage
12934,https://svs.gsfc.nasa.gov/12934/,RXTE Photos
12935,https://svs.gsfc.nasa.gov/12935/,Webb Telescope Scientists and Engineers at Johnson Space Center's Control Room B-Roll
12936,https://svs.gsfc.nasa.gov/12936/,NASA's Johnson Space Center's Building 32 Facility B-Roll
12937,https://svs.gsfc.nasa.gov/12937/,Hubble's 28th Anniversary
12938,https://svs.gsfc.nasa.gov/12938/,NICER Finds X-ray Pulsar in Record-fast Orbit
12939,https://svs.gsfc.nasa.gov/12939/,May the Forest Be with You: GEDI Moves Toward Launch To Space Station
12940,https://svs.gsfc.nasa.gov/12940/,360 Facebook Live - Hubble's 28th Anniversary
12941,https://svs.gsfc.nasa.gov/12941/,Massive Crater Discovered under Greenland Ice
12943,https://svs.gsfc.nasa.gov/12943/,Explorer 1
12944,https://svs.gsfc.nasa.gov/12944/,Pumpkin Stars
12945,https://svs.gsfc.nasa.gov/12945/,Living Planet
12946,https://svs.gsfc.nasa.gov/12946/,Solar Power: Parker Solar Probe Tests Its Arrays
12947,https://svs.gsfc.nasa.gov/12947/,Launching an ICON
12948,https://svs.gsfc.nasa.gov/12948/,Dropped into a Hurricane
12949,https://svs.gsfc.nasa.gov/12949/,Star Collision
12950,https://svs.gsfc.nasa.gov/12950/,A Map of Freshwater
12951,https://svs.gsfc.nasa.gov/12951/,Ancient Organics Discovered on Mars
12952,https://svs.gsfc.nasa.gov/12952/,A Decade of Fermi TGFs
12953,https://svs.gsfc.nasa.gov/12953/,Parker Solar Probe Gets Visit From Namesake
12956,https://svs.gsfc.nasa.gov/12956/,"Spectroscopy, Explained"
12957,https://svs.gsfc.nasa.gov/12957/,"During a Year in Orbit, IceCube Created a New Map of Earth's Clouds"
12958,https://svs.gsfc.nasa.gov/12958/,Using Precipitation Data to Assess Risk of Cholera Outbreaks
12959,https://svs.gsfc.nasa.gov/12959/,More than 1.1 Million Names Installed on NASA’s Parker Solar Probe
12960,https://svs.gsfc.nasa.gov/12960/,Ionosphere Graphics
12961,https://svs.gsfc.nasa.gov/12961/,ICON Graphics
12962,https://svs.gsfc.nasa.gov/12962/,Searching for Signs of Life on Mars
12963,https://svs.gsfc.nasa.gov/12963/,Airglow Imagery
12966,https://svs.gsfc.nasa.gov/12966/,Measuring the Atmosphere on ATom's Final Flight Around the World
12967,https://svs.gsfc.nasa.gov/12967/,Ancient Organics Discovered on Mars - Broadcast Graphics
12968,https://svs.gsfc.nasa.gov/12968/,PIPER Infographic
12969,https://svs.gsfc.nasa.gov/12969/,Fermi Satellite Celebrates 10 Years of Discoveries
12971,https://svs.gsfc.nasa.gov/12971/,Unboxing a New NASA Spacecraft
12972,https://svs.gsfc.nasa.gov/12972/,NASA Interns Arrive at Goddard - Summer 2018
12973,https://svs.gsfc.nasa.gov/12973/,NASA's Heliophysics Fleet
12974,https://svs.gsfc.nasa.gov/12974/,ICON's Launch Site
12975,https://svs.gsfc.nasa.gov/12975/,ICON Photos
12976,https://svs.gsfc.nasa.gov/12976/,OSIRIS-REx L-30 Press Briefing Graphics
12977,https://svs.gsfc.nasa.gov/12977/,Mass Balance of Ice Sheets
12978,https://svs.gsfc.nasa.gov/12978/,Parker Solar Probe--Mission Overview
12979,https://svs.gsfc.nasa.gov/12979/,Power Up: Solar Arrays Installed on NASA’s Mission to Touch the Sun
12980,https://svs.gsfc.nasa.gov/12980/,Swift Millionth Image Mosaic
12981,https://svs.gsfc.nasa.gov/12981/,Webb Telescope Optical Telescope Element Engineering History Presentation Supporting Video
12982,https://svs.gsfc.nasa.gov/12982/,Amazon Canopy Comes to Life through Laser Data
12983,https://svs.gsfc.nasa.gov/12983/,Dust in the Wind
12984,https://svs.gsfc.nasa.gov/12984/,ICESat-2's Eye on Ice
12985,https://svs.gsfc.nasa.gov/12985/,NASA at Fenway
12986,https://svs.gsfc.nasa.gov/12986/,Mars Proton Aurora
12987,https://svs.gsfc.nasa.gov/12987/,James Webb Space Telescope: Worth the Wait
12988,https://svs.gsfc.nasa.gov/12988/,Is 'Oumuamua an Interstellar Asteroid or Comet?
12989,https://svs.gsfc.nasa.gov/12989/,Superstar Eta Carinae Shoots Cosmic Rays
12991,https://svs.gsfc.nasa.gov/12991/,NASA Surveys Hurricane Damage to Puerto Rico's Forests
12992,https://svs.gsfc.nasa.gov/12992/,Cutting-Edge Heat Shield Installed on NASA’s Parker Solar Probe
12993,https://svs.gsfc.nasa.gov/12993/,Testing Robotic Satellite Servicing Capabilities
12994,https://svs.gsfc.nasa.gov/12994/,NASA's Fermi Links Cosmic Neutrino to Monster Black Hole
12996,https://svs.gsfc.nasa.gov/12996/,National Intern Day with Administrator Bridenstine
12997,https://svs.gsfc.nasa.gov/12997/,Parker Solar Probe Beauty Images
12998,https://svs.gsfc.nasa.gov/12998/,Parker Solar Probe Orbit From August 2018 - March 2019
12999,https://svs.gsfc.nasa.gov/12999/,Parker Solar Probe Path Across Sun's Surface
13000,https://svs.gsfc.nasa.gov/13000/,Pluto's Underground Ocean
13001,https://svs.gsfc.nasa.gov/13001/,Parker Solar Probe
13002,https://svs.gsfc.nasa.gov/13002/,Mars Organic Molecule Analyzer: Footage
13003,https://svs.gsfc.nasa.gov/13003/,Parker Solar Probe Science Briefing - Visual Resources
13005,https://svs.gsfc.nasa.gov/13005/,Why Do We Love Space?
13006,https://svs.gsfc.nasa.gov/13006/,Hubble Sees Summer Storms on Mars and Saturn
13007,https://svs.gsfc.nasa.gov/13007/,Jupiter Magnetic Tour
13008,https://svs.gsfc.nasa.gov/13008/,Eugene Parker Imagery
13010,https://svs.gsfc.nasa.gov/13010/,Webb's Optical Telescope Element and Spacecraft Element in Northrop Grumman's Cleanroom B-Roll
13011,https://svs.gsfc.nasa.gov/13011/,Sounds of the Sun
13012,https://svs.gsfc.nasa.gov/13012/,OSIRIS-REx Approach Media Telecon
13013,https://svs.gsfc.nasa.gov/13013/,NASA's Most Scientifically Complex Space Observatory Requires Precision
13014,https://svs.gsfc.nasa.gov/13014/,Webb - A Tale of Precise Construction
13016,https://svs.gsfc.nasa.gov/13016/,Mars Evolution from Wet to Dry
13017,https://svs.gsfc.nasa.gov/13017/,It's Surprisingly Hard to Go to the Sun
13019,https://svs.gsfc.nasa.gov/13019/,NASA's Mission to Touch the Sun Launches Next Week
13020,https://svs.gsfc.nasa.gov/13020/,Sounds of NASA’s Robotic Operations Center
13021,https://svs.gsfc.nasa.gov/13021/,EXPORTS -- B-roll and Media
13022,https://svs.gsfc.nasa.gov/13022/,Exoplanet Transit Animations
13023,https://svs.gsfc.nasa.gov/13023/,Elegance: Music & Math
13024,https://svs.gsfc.nasa.gov/13024/,Parker Solar Probe Prepares to Head Toward Launch Pad
13025,https://svs.gsfc.nasa.gov/13025/,NASA Scientist Reveals Greenland's Geologic Past
13028,https://svs.gsfc.nasa.gov/13028/,Parker Solar Probe Media Telecons
13029,https://svs.gsfc.nasa.gov/13029/,Parker Solar Probe Pre-Launch Briefing
13030,https://svs.gsfc.nasa.gov/13030/,NASA's Planet-Hunting TESS Catches a Comet Before Starting Science
13031,https://svs.gsfc.nasa.gov/13031/,NASA'S NICER Does the Space Station Twist
13032,https://svs.gsfc.nasa.gov/13032/,Two Research Vessels Leave for the Twilight Zone
13033,https://svs.gsfc.nasa.gov/13033/,A Story of Science and Friendship
13034,https://svs.gsfc.nasa.gov/13034/,Parker Solar Probe Pre-launch Video File
13035,https://svs.gsfc.nasa.gov/13035/,Parker Solar Probe Instruments
13036,https://svs.gsfc.nasa.gov/13036/,Soundbites from Parker Solar Probe Experts
13038,https://svs.gsfc.nasa.gov/13038/,Eugene Parker Soundbites
13039,https://svs.gsfc.nasa.gov/13039/,Eugene Parker Reacts To Parker Solar Probe Launch
13040,https://svs.gsfc.nasa.gov/13040/,Launch of Parker Solar Probe
13041,https://svs.gsfc.nasa.gov/13041/,Fermi's Gamma-ray Burst Monitor
13042,https://svs.gsfc.nasa.gov/13042/,NASA's Fermi Mission Shows How Luck Favors the Prepared
13043,https://svs.gsfc.nasa.gov/13043/,New Simulation Sheds Light on Spiraling Supermassive Black Holes
13044,https://svs.gsfc.nasa.gov/13044/,ICESat-2 L-30 Science Briefing Graphics
13045,https://svs.gsfc.nasa.gov/13045/,ICESat-2 Launch Live Interviews
13046,https://svs.gsfc.nasa.gov/13046/,Sunset Show for Parker Solar Probe
13047,https://svs.gsfc.nasa.gov/13047/,New Arctic Lakes Could Soon Be a Major Source of Atmospheric Methane
13049,https://svs.gsfc.nasa.gov/13049/,ICESat-2 Measures Sea Ice Thickness
13051,https://svs.gsfc.nasa.gov/13051/,NASA's OSIRIS-REx Approaches Asteroid Bennu
13053,https://svs.gsfc.nasa.gov/13053/,GLOBE Adopt a Pixel
13055,https://svs.gsfc.nasa.gov/13055/,A Slowly Spinning Comet
13056,https://svs.gsfc.nasa.gov/13056/,EPIC New Science from 1 Million Miles Away
13057,https://svs.gsfc.nasa.gov/13057/,Thermonuclear Art: The Sun in UHD
13058,https://svs.gsfc.nasa.gov/13058/,Simulations Create New Insights Into Pulsars
13059,https://svs.gsfc.nasa.gov/13059/,Hubble Archive - Pre-Launch
13060,https://svs.gsfc.nasa.gov/13060/,360-Degree Virtual Tour of Hubble Mission Operations
13061,https://svs.gsfc.nasa.gov/13061/,Hubble Treasure Trove Sonification
13062,https://svs.gsfc.nasa.gov/13062/,ICESat-2 Por Los Números (en Español)
13064,https://svs.gsfc.nasa.gov/13064/,Científicos Hispanos de la NASA: Miguel Román
13065,https://svs.gsfc.nasa.gov/13065/,Countdown to ICESat-2 Launch
13068,https://svs.gsfc.nasa.gov/13068/,ICESat-2 Infographic
13069,https://svs.gsfc.nasa.gov/13069/,NASA’s TESS Releases First Science Image
13070,https://svs.gsfc.nasa.gov/13070/,500th Anniversary of Humanity's First Circumnavigation of Earth
13071,https://svs.gsfc.nasa.gov/13071/,Why NASA Studies Hurricanes. Soundbites From Owen Kelley
13072,https://svs.gsfc.nasa.gov/13072/,Parker Solar Probe First Light Data
13073,https://svs.gsfc.nasa.gov/13073/,Rare Electric Blue Clouds Observed By NASA Balloon
13075,https://svs.gsfc.nasa.gov/13075/,2018 Arctic Sea Ice Ties for Sixth Lowest Minimum Extent on NASA Record
13076,https://svs.gsfc.nasa.gov/13076/,Grand Challenge-Cusp Graphics
13078,https://svs.gsfc.nasa.gov/13078/,Water Released from Moon During Meteor Showers
13079,https://svs.gsfc.nasa.gov/13079/,Inside Hurricane Maria in 360°
13080,https://svs.gsfc.nasa.gov/13080/,James Webb Space Telescope Beryllium Mining and Manufacturing B-Roll
13081,https://svs.gsfc.nasa.gov/13081/,"Hubble Archive - Launch, STS-31"
13082,https://svs.gsfc.nasa.gov/13082/,"Hubble Archive - Servicing Mission 1, STS-61"
13083,https://svs.gsfc.nasa.gov/13083/,Hubble Archive - Post-Deployment
13084,https://svs.gsfc.nasa.gov/13084/,Hubble Archive - Post-Servicing Mission 1
13086,https://svs.gsfc.nasa.gov/13086/,Supermassive Black Hole Binary Simulation Visualizations in 4k
13087,https://svs.gsfc.nasa.gov/13087/,Hubble Evidence of Possible Exomoon
13089,https://svs.gsfc.nasa.gov/13089/,Arctic Sea Ice Cover Is the Thinnest and Youngest It's Been in 60 Years
13090,https://svs.gsfc.nasa.gov/13090/,GEDI Media Resources
13091,https://svs.gsfc.nasa.gov/13091/,James Webb Space Telescope in 360 at Johnson Space Center
13092,https://svs.gsfc.nasa.gov/13092/,Greenland's Jakobshavn Glacier Reacts to Changing Ocean Temperatures
13093,https://svs.gsfc.nasa.gov/13093/,Hubble Technology Detected Science Writer's Breast Cancer
13094,https://svs.gsfc.nasa.gov/13094/,Multimessenger Timeline Resources
13095,https://svs.gsfc.nasa.gov/13095/,Bright Spots
13096,https://svs.gsfc.nasa.gov/13096/,ICON Pre-Launch Live Shots
13097,https://svs.gsfc.nasa.gov/13097/,Fermi Scientists Introduce Gamma-ray Constellations
13100,https://svs.gsfc.nasa.gov/13100/,GEDI: Mapping Carbon in 3-D
13101,https://svs.gsfc.nasa.gov/13101/,NASA Catches Super Typhoon Yutu Making Landfall
13103,https://svs.gsfc.nasa.gov/13103/,2018 Ozone Hole Is a Reminder of What Almost Was
13104,https://svs.gsfc.nasa.gov/13104/,Tracing the History of Starlight with NASA's Fermi Mission
13105,https://svs.gsfc.nasa.gov/13105/,First Perihelion: Into the Unknown with Parker Solar Probe
13106,https://svs.gsfc.nasa.gov/13106/,Tour the Plane Giving NASA’s ICON a Ride to Space
13107,https://svs.gsfc.nasa.gov/13107/,ICON Video File
13108,https://svs.gsfc.nasa.gov/13108/,NASA Goddard Hosts Young Women for 'STEM Girls Night In'
13109,https://svs.gsfc.nasa.gov/13109/,The James Webb Space Telescope's Spacecraft Element Tent Cover B-Roll
13110,https://svs.gsfc.nasa.gov/13110/,NASA's View of Pine Island Glacier's Latest Iceberg
13111,https://svs.gsfc.nasa.gov/13111/,Sounds of A Launch
13112,https://svs.gsfc.nasa.gov/13112/,Why Bennu?
13113,https://svs.gsfc.nasa.gov/13113/,AGU 2018 - Expected Data and Scientific Discovery from NASA’s Parker Solar Probe
13114,https://svs.gsfc.nasa.gov/13114/,GEDI Overview
13115,https://svs.gsfc.nasa.gov/13115/,The James Webb Space Telescope's Spacecraft Element Tent Cover Time-Lapse B-Roll
13116,https://svs.gsfc.nasa.gov/13116/,The James Webb Space Telescope's Spacecraft Element Moved for Acoustic Testing B-Roll
13117,https://svs.gsfc.nasa.gov/13117/,Snow over Antarctica Buffered Sea Level Rise during Last Century
13118,https://svs.gsfc.nasa.gov/13118/,Cryosphere | Episode 8: The Launch
13119,https://svs.gsfc.nasa.gov/13119/,Cryosphere | Episode 2: The Snow Below
13122,https://svs.gsfc.nasa.gov/13122/,Apollo 8 - 50th Anniversary Montage
13123,https://svs.gsfc.nasa.gov/13123/,Bennu Orbit Insertion
13124,https://svs.gsfc.nasa.gov/13124/,A Slice of Ice
13125,https://svs.gsfc.nasa.gov/13125/,Arrival at Bennu
13126,https://svs.gsfc.nasa.gov/13126/,Predicting Landslides
13127,https://svs.gsfc.nasa.gov/13127/,Arctic Bubbles
13128,https://svs.gsfc.nasa.gov/13128/,Greenland on the move
13129,https://svs.gsfc.nasa.gov/13129/,Yellowstone Fire: Then and Now
13131,https://svs.gsfc.nasa.gov/13131/,Missing Dark Matter
13132,https://svs.gsfc.nasa.gov/13132/,From Interstellar Space
13136,https://svs.gsfc.nasa.gov/13136/,Moon Craters a Window to Earth's Past
13142,https://svs.gsfc.nasa.gov/13142/,2018 Was the Fourth Hottest Year on Record
13143,https://svs.gsfc.nasa.gov/13143/,NASA's Mission Through Dangerous Space Is Going Out in Style
13144,https://svs.gsfc.nasa.gov/13144/,Moon Sheds Light on Earth's Impact History
13145,https://svs.gsfc.nasa.gov/13145/,Economics of Nature: Mapping Liberia’s Ecosystems to Understand Their Value
13146,https://svs.gsfc.nasa.gov/13146/,NASA Finds Second Massive Greenland Crater
13147,https://svs.gsfc.nasa.gov/13147/,Volunteer Discovers Record-Setting White Dwarf Star
13148,https://svs.gsfc.nasa.gov/13148/,5 Things About Earth’s Radiation Donuts
13149,https://svs.gsfc.nasa.gov/13149/,GLOBE Observer Clouds: Getting Started
13150,https://svs.gsfc.nasa.gov/13150/,"Magnetic Bubbles on the Moon Reveal Evidence of ""Sunburn"""
13151,https://svs.gsfc.nasa.gov/13151/,Five Years of GPM Storms
13152,https://svs.gsfc.nasa.gov/13152/,2015-2016 El Niño Triggered Disease Outbreaks Across the Globe
13153,https://svs.gsfc.nasa.gov/13153/,NASA Science Live: To the Moon and Beyond (Episode 01)
13154,https://svs.gsfc.nasa.gov/13154/,OSIRIS-REx LPSC Media Telecon
13155,https://svs.gsfc.nasa.gov/13155/,Going Interstellar with TESS and Kepler
13156,https://svs.gsfc.nasa.gov/13156/,NASA’s Fermi Satellite Clocks a ‘Cannonball’ Pulsar
13157,https://svs.gsfc.nasa.gov/13157/,2019 Arctic Sea Ice Maximum Continues Trend of Decline
13159,https://svs.gsfc.nasa.gov/13159/,5 Things About Interstellar Space
13160,https://svs.gsfc.nasa.gov/13160/,"Hubble Archive - Servicing Mission 4, STS-125"
13161,https://svs.gsfc.nasa.gov/13161/,NASA Science Live: Going Interstellar (Episode 02)
13162,https://svs.gsfc.nasa.gov/13162/,Flying Alaskan Glaciers
13163,https://svs.gsfc.nasa.gov/13163/,Water Vapor Plumes on Europa
13165,https://svs.gsfc.nasa.gov/13165/,NASA's Webb Telescope Shines with American Ingenuity
13166,https://svs.gsfc.nasa.gov/13166/,Heliophysics Overview
13167,https://svs.gsfc.nasa.gov/13167/,VISIONS-2 Aurora Imagery
13169,https://svs.gsfc.nasa.gov/13169/,Grand Challenge-Cusp Graphics (updated)
13171,https://svs.gsfc.nasa.gov/13171/,Grand Challenge Initiative - Cusp: Launch Photos & Videos
13172,https://svs.gsfc.nasa.gov/13172/,VISIONS-2 Imagery
13173,https://svs.gsfc.nasa.gov/13173/,Trees Around the GLOBE
13174,https://svs.gsfc.nasa.gov/13174/,Hubble Tool Time Promo
13175,https://svs.gsfc.nasa.gov/13175/,Hubble Tool Time Episode 1 - Astronaut Training
13176,https://svs.gsfc.nasa.gov/13176/,Hubble Tool Time Episode 2 - Servicing Mission 1
13177,https://svs.gsfc.nasa.gov/13177/,Hubble Tool Time Episode 3 - Servicing Mission 2
13178,https://svs.gsfc.nasa.gov/13178/,Hubble Tool Time Episode 4 - Servicing Mission 3A
13179,https://svs.gsfc.nasa.gov/13179/,Hubble Tool Time Episode 5 - Servicing Mission 3B
13180,https://svs.gsfc.nasa.gov/13180/,Hubble Tool Time Episode 6 - Servicing Mission 4
13181,https://svs.gsfc.nasa.gov/13181/,Sounding Rocket Animations
13183,https://svs.gsfc.nasa.gov/13183/,Earth Day 2019 Live Shots
13184,https://svs.gsfc.nasa.gov/13184/,Goddard at 60
13186,https://svs.gsfc.nasa.gov/13186/,Servicing Mission 4 Overview
13187,https://svs.gsfc.nasa.gov/13187/,GLOBE Observer Land Cover: Getting Started
13188,https://svs.gsfc.nasa.gov/13188/,Earth from Orbit 2019: How NASA Satellites #PictureEarth
13189,https://svs.gsfc.nasa.gov/13189/,Hubble's 29th Anniversary
13191,https://svs.gsfc.nasa.gov/13191/,NASA Science Live: Our Weird Home (Episode 03)
13192,https://svs.gsfc.nasa.gov/13192/,NASA Helps Warn of Harmful Algal Blooms
13193,https://svs.gsfc.nasa.gov/13193/,Space Down to Earth
13194,https://svs.gsfc.nasa.gov/13194/,"Distant Planet May Be On Its Second Atmosphere, NASA’s Hubble Finds"
13195,https://svs.gsfc.nasa.gov/13195/,Goddard Space Flight Center Archival Footage
13196,https://svs.gsfc.nasa.gov/13196/,Hubble Servicing Mission 4 Archive Teaser
13197,https://svs.gsfc.nasa.gov/13197/,Gravitational Wave Simulations of Merging Black Holes: 1080 and 8k Resolutions
13198,https://svs.gsfc.nasa.gov/13198/,Human Influence on Global Droughts Goes Back 100 Years
13199,https://svs.gsfc.nasa.gov/13199/,XMM-Newton Anniversary Products
13200,https://svs.gsfc.nasa.gov/13200/,NASA’s TESS Finds Three New Worlds
13201,https://svs.gsfc.nasa.gov/13201/,"The Story of Robert Goddard, Father of Modern Rocketry"
13203,https://svs.gsfc.nasa.gov/13203/,Astronauts Celebrate Hubble Servicing Mission Live Shots
13204,https://svs.gsfc.nasa.gov/13204/,NASA Explorers | Season Two: Apollo
13206,https://svs.gsfc.nasa.gov/13206/,88-South Antarctic Traverse: Year Two
13207,https://svs.gsfc.nasa.gov/13207/,OSIRIS-REx Social Media Interviews
13208,https://svs.gsfc.nasa.gov/13208/,The 20-foot Solar Array Powering the James Webb Space Telescope
13209,https://svs.gsfc.nasa.gov/13209/,NASA’s Fermi Finds Vast ‘Halo’ Around Nearby Pulsar
13211,https://svs.gsfc.nasa.gov/13211/,GLOBE Observer Trees
13212,https://svs.gsfc.nasa.gov/13212/,NASA Science Live: Storms Across the Solar System (Episode 04)
13213,https://svs.gsfc.nasa.gov/13213/,STSCI Operation Control Room B-Roll
13214,https://svs.gsfc.nasa.gov/13214/,NICER's Night Moves
13215,https://svs.gsfc.nasa.gov/13215/,NASA Selects First Commercial Moon Landing Services for Artemis Program Live Shots
13216,https://svs.gsfc.nasa.gov/13216/,NASA Has Eyes On The Atlantic Hurricane Season
13217,https://svs.gsfc.nasa.gov/13217/,NASA Interns Arrive at Goddard - Summer 2019
13218,https://svs.gsfc.nasa.gov/13218/,NASA Science Live: Next Steps to Science on the Moon (Special Edition)
13219,https://svs.gsfc.nasa.gov/13219/,WFIRST Spacecraft Stills
13220,https://svs.gsfc.nasa.gov/13220/,Ten Years of High-Energy Gamma-ray Bursts
13221,https://svs.gsfc.nasa.gov/13221/,NASA Tech on SpaceX Falcon Heavy Launch - Media Telecon Resources
13222,https://svs.gsfc.nasa.gov/13222/,Goddard Astrobiology Analytical Laboratory (Footage)
13223,https://svs.gsfc.nasa.gov/13223/,TESS Discovers Its Tiniest World To Date
13225,https://svs.gsfc.nasa.gov/13225/,SET Beauty Pass Animation
13226,https://svs.gsfc.nasa.gov/13226/,NASA Kicks Off A Lunar Summer: Share Your Apollo Stories Live Shots
13227,https://svs.gsfc.nasa.gov/13227/,NASA Follows Changing Freshwater from Space
13228,https://svs.gsfc.nasa.gov/13228/,NASA Goddard Hosts Young Men for 'STEM Boys Night In'
13229,https://svs.gsfc.nasa.gov/13229/,10 Years at the Moon
13230,https://svs.gsfc.nasa.gov/13230/,2019 Administrator's Agency Honor Awards Ceremony
13231,https://svs.gsfc.nasa.gov/13231/,James Webb Space Telescope's Spacecraft Element is Moved Back into the Cleanroom B-Roll
13232,https://svs.gsfc.nasa.gov/13232/,OPSPARC Challenge 2019 Promotional Videos
13233,https://svs.gsfc.nasa.gov/13233/,Modeling the Future of the Greenland Ice Sheet
13235,https://svs.gsfc.nasa.gov/13235/,NASA's Nancy Grace Roman Space Telescope's Wide Field Instrument
13236,https://svs.gsfc.nasa.gov/13236/,Fermi Sees the Moon in Gamma Rays
13237,https://svs.gsfc.nasa.gov/13237/,TESS Catches Its First Star-destroying Black Hole
13238,https://svs.gsfc.nasa.gov/13238/,Highlights From TESS's First Year
13239,https://svs.gsfc.nasa.gov/13239/,Zoom In on Galaxy M87
13240,https://svs.gsfc.nasa.gov/13240/,"NASA’s NICER Sizes Up a Pulsar, Reveals First-ever Surface Map"
13242,https://svs.gsfc.nasa.gov/13242/,Using NASA Data to Monitor Drought and Food Insecurity
13243,https://svs.gsfc.nasa.gov/13243/,NASA Tracks the Future of Asia's Glaciers
13244,https://svs.gsfc.nasa.gov/13244/,Hubble’s Brand New Image of Eta Carinae
13245,https://svs.gsfc.nasa.gov/13245/,NASA Science Live: NASA's Next New Frontiers Mission [Special Edition]
13246,https://svs.gsfc.nasa.gov/13246/,NASA’s 50th Anniversary Of The Apollo 11 Moon Landing Live Shots
13247,https://svs.gsfc.nasa.gov/13247/,Landsat 9 Teaser Promo
13248,https://svs.gsfc.nasa.gov/13248/,NASA’s Newest Planet Hunter To Reveal New Results From Its First Year In Orbit Live Shots
13249,https://svs.gsfc.nasa.gov/13249/,Eclipse 2019
13250,https://svs.gsfc.nasa.gov/13250/,Katherine Johnson Independent Verification and Validation B-roll
13251,https://svs.gsfc.nasa.gov/13251/,Hubble Career Page 360 Degree Video
13252,https://svs.gsfc.nasa.gov/13252/,RockOn! 2019
13253,https://svs.gsfc.nasa.gov/13253/,A Drier Future Sets the Stage for More Wildfires
13254,https://svs.gsfc.nasa.gov/13254/,Connect the Drops with NASA Data
13255,https://svs.gsfc.nasa.gov/13255/,NASA Science Live: 50 Years of Apollo (Episode 7)
13256,https://svs.gsfc.nasa.gov/13256/,JWST's Spacecraft Element Returns to its Cleanroom after Successfully Thermal Vacuum Testing
13257,https://svs.gsfc.nasa.gov/13257/,"Through Smoke and Fire, NASA Searches for Answers"
13258,https://svs.gsfc.nasa.gov/13258/,Hubble and Going Forward to the Moon
13259,https://svs.gsfc.nasa.gov/13259/,Landsat 9 Spacecraft Animations and Stills
