ID,URL,Title
1,https://svs.gsfc.nasa.gov/1/,Tidal Streams in Massive X-ray Binary Systems
2,https://svs.gsfc.nasa.gov/2/,Tidal Streams in Massive X-ray Binary Systems: Neutron Star Close-up
3,https://svs.gsfc.nasa.gov/3/,Stellar Wind Disruption by an Orbiting Neutron Star
4,https://svs.gsfc.nasa.gov/4/,Stellar Wind Disruption by an Orbiting Neutron Star: Low X-Ray Luminosity
5,https://svs.gsfc.nasa.gov/5/,Stellar Wind Disruption by an Orbiting Neutron Star: Moderate X-Ray Luminosity
6,https://svs.gsfc.nasa.gov/6/,Stellar Wind Disruption by an Orbiting Neutron Star: High X-Ray Luminosity
7,https://svs.gsfc.nasa.gov/7/,Stellar Wind Disruption by an Orbiting Neutron Star: Neutron Star Close-up
8,https://svs.gsfc.nasa.gov/8/,Topological Features of a Compressible Plasma Vortex Sheet: 6 Cases
9,https://svs.gsfc.nasa.gov/9/,Topological Features of a Compressible Plasma Vortex Sheet - a Model of the Outer Heliospheric Wind
10,https://svs.gsfc.nasa.gov/10/,Restorer: A Visualization Technique for Handling Missing Data
11,https://svs.gsfc.nasa.gov/11/,Restorer: Four Color Chart
12,https://svs.gsfc.nasa.gov/12/,Restorer: An Example of Constant Data Gaps
13,https://svs.gsfc.nasa.gov/13/,Restorer: An Example of Time-varying Data Gaps
14,https://svs.gsfc.nasa.gov/14/,Restorer: An Example with Ozone Data
15,https://svs.gsfc.nasa.gov/15/,SEDS-I: Subsatellite in motion (30 frames/second)
16,https://svs.gsfc.nasa.gov/16/,SEDS-I: Subsatellite in motion (6 frames/second)
17,https://svs.gsfc.nasa.gov/17/,SEDS-I: Subsatellite in motion (every 10th frame)
18,https://svs.gsfc.nasa.gov/18/,SEDS-II: Before and After Deployment
19,https://svs.gsfc.nasa.gov/19/,SEDS-II: Slowest period of deployment
20,https://svs.gsfc.nasa.gov/20/,SEDS-II: End of Deployment
21,https://svs.gsfc.nasa.gov/21/,SEDS-II: Final Dynamic State
22,https://svs.gsfc.nasa.gov/22/,SEDS-II: First 120 Minutes
23,https://svs.gsfc.nasa.gov/23/,Changes in Glacier Bay: Glacier Fly Up
24,https://svs.gsfc.nasa.gov/24/,Changes in Glacier Bay: Glacier Zoom In
25,https://svs.gsfc.nasa.gov/25/,Changes in Glacier Bay: Muir Glacier
26,https://svs.gsfc.nasa.gov/26/,Changes in Glacier Bay: Riggs and McBride Glaciers
27,https://svs.gsfc.nasa.gov/27/,Changes in Glacier Bay: Casement Glacier
28,https://svs.gsfc.nasa.gov/28/,Changes in Glacier Bay: Brady Glacier
29,https://svs.gsfc.nasa.gov/29/,Changes in Glacier Bay: Reid and Lamplugh Glaciers
30,https://svs.gsfc.nasa.gov/30/,Changes in Glacier Bay: Margerie Glacier
31,https://svs.gsfc.nasa.gov/31/,Changes in Glacier Bay: Grand Pacific Glacier
32,https://svs.gsfc.nasa.gov/32/,Changes in Glacier Bay: Rendu Glacier
33,https://svs.gsfc.nasa.gov/33/,Changes in Glacier Bay: Carroll and Cushing Glaciers
34,https://svs.gsfc.nasa.gov/34/,Changes in Glacier Bay: Burroughs Glacier
35,https://svs.gsfc.nasa.gov/35/,Changes in Glacier Bay: Fly Around Glacier Bay
36,https://svs.gsfc.nasa.gov/36/,1992 Daily Ozone from Nimbus-7
37,https://svs.gsfc.nasa.gov/37/,1993 Daily Ozone from Nimbus-7
38,https://svs.gsfc.nasa.gov/38/,1993 Daily Ozone from Meteor-3
39,https://svs.gsfc.nasa.gov/39/,Rayleigh-Taylor Instabilities in Supernovae Explosions: Density
40,https://svs.gsfc.nasa.gov/40/,Rayleigh-Taylor Instabilities in Supernovae Explosions: Hydrogen Mass Fraction
41,https://svs.gsfc.nasa.gov/41/,Rayleigh-Taylor Instabilities in Supernovae Explosions: Partial Density of Hydrogen
42,https://svs.gsfc.nasa.gov/42/,Rayleigh-Taylor Instabilities in Supernovae Explosions: Helium Mass Fraction
43,https://svs.gsfc.nasa.gov/43/,Rayleigh-Taylor Instabilities in Supernovae Explosions: Partial Density of Helium
44,https://svs.gsfc.nasa.gov/44/,Rayleigh-Taylor Instabilities in Supernovae Explosions: Oxygen Mass Fraction
45,https://svs.gsfc.nasa.gov/45/,Rayleigh-Taylor Instabilities in Supernovae Explosions: Partial Density of Oxygen
46,https://svs.gsfc.nasa.gov/46/,Instabilities in Very Young Neutron Stars: Density
47,https://svs.gsfc.nasa.gov/47/,Instabilities in Very Young Neutron Stars: Temperature
48,https://svs.gsfc.nasa.gov/48/,Instabilities in Very Young Neutron Stars: Electron Fraction
49,https://svs.gsfc.nasa.gov/49/,River Erosion Prototype
50,https://svs.gsfc.nasa.gov/50/,River Erosion Prototype 2
51,https://svs.gsfc.nasa.gov/51/,Erosion Over Folded Rock Structures
52,https://svs.gsfc.nasa.gov/52/,Ocean Planet: Rotation of an AVHRR Data Set
53,https://svs.gsfc.nasa.gov/53/,Ocean Planet: Map of Flight Path
54,https://svs.gsfc.nasa.gov/54/,Ocean Planet: Rough Planet Earth without Ocean
55,https://svs.gsfc.nasa.gov/55/,Ocean Planet: Rough Cut Hawaii Flyby
56,https://svs.gsfc.nasa.gov/56/,Ocean Planet: Rough Cut Galapagos Flyby
57,https://svs.gsfc.nasa.gov/57/,Ocean Planet: Rough Cut Ship and Submersible Flyby
58,https://svs.gsfc.nasa.gov/58/,Ocean Planet: Partial Tour with Map Route Inset
59,https://svs.gsfc.nasa.gov/59/,Ocean Planet: Final Version
60,https://svs.gsfc.nasa.gov/60/,Nonlinear Studies of Coronal Heating by the Resonant Absorption of Alfven Waves
61,https://svs.gsfc.nasa.gov/61/,"Hurricane Hugo from AVHRR: September 21, 1989 (Dark)"
62,https://svs.gsfc.nasa.gov/62/,ISCCP Global Cloud Cover
63,https://svs.gsfc.nasa.gov/63/,Terrestrial Biosphere
64,https://svs.gsfc.nasa.gov/64/,Fusion of Atmospheric and Terrestrial Data Sets
65,https://svs.gsfc.nasa.gov/65/,Galapagos Islands Flyby
66,https://svs.gsfc.nasa.gov/66/,Crustal Dynamics Project
67,https://svs.gsfc.nasa.gov/67/,Amazon Deforestation Model
68,https://svs.gsfc.nasa.gov/68/,Ocean Waves Model
69,https://svs.gsfc.nasa.gov/69/,"Hurricane Hugo from AVHRR: September 21, 1989 (Bright)"
70,https://svs.gsfc.nasa.gov/70/,Galapagos Island Underwater Tour
71,https://svs.gsfc.nasa.gov/71/,Global Cloud Cover with Fly Away
72,https://svs.gsfc.nasa.gov/72/,Magnetosphere Simulation
73,https://svs.gsfc.nasa.gov/73/,Continental Drift
74,https://svs.gsfc.nasa.gov/74/,Mt. Pinatubo Aerosols
75,https://svs.gsfc.nasa.gov/75/,The Relationship of the Sun to the Earth
76,https://svs.gsfc.nasa.gov/76/,TOMS Ozone and Albedo
77,https://svs.gsfc.nasa.gov/77/,Cycles of the Atmosphere: Modules 1-3
78,https://svs.gsfc.nasa.gov/78/,Ocean Planet: Final Version with Credits
79,https://svs.gsfc.nasa.gov/79/,Lunar Rotation and Flyby from Clementine Data (with route map)
80,https://svs.gsfc.nasa.gov/80/,Lunar Rotation and Flyby from Clementine Data
81,https://svs.gsfc.nasa.gov/81/,Hurricane Florence with Inset of VR Operator
82,https://svs.gsfc.nasa.gov/82/,Hurricane Florence
83,https://svs.gsfc.nasa.gov/83/,VR Operator
84,https://svs.gsfc.nasa.gov/84/,Simulations of the Breakup of Comet Shoemaker-Levy 9 Employing a Swarm Model: Initial Conditions
85,https://svs.gsfc.nasa.gov/85/,Simulations of the Breakup of Comet Shoemaker-Levy 9 Employing a Swarm Model: Dynamical Evolution
86,https://svs.gsfc.nasa.gov/86/,2-D Unstructured Mesh Particle-MHD Solar Wind Flow Over the Earth: Magnetic Potential
87,https://svs.gsfc.nasa.gov/87/,2-D Unstructured Mesh Particle-MHD Solar Wind Flow Over the Earth:Density and Magnetic Field
88,https://svs.gsfc.nasa.gov/88/,"Magnetic Cloud Event: October 18-20, 1995"
89,https://svs.gsfc.nasa.gov/89/,SAMPEX - A Synoptic View of Earth's Electron Radiation Belts: North Pole Energetic Fluxes from HILT
90,https://svs.gsfc.nasa.gov/90/,SAMPEX - Yohkoh: Solar Modification of Relativistic Electrons in the Earth's Radiation Belts
91,https://svs.gsfc.nasa.gov/91/,"Motion in the R-Aquarii Jet 1991, 1992, 1993: Image Deconvolution of 1992 Data"
92,https://svs.gsfc.nasa.gov/92/,Skeletal Modeling Dynamic Simulation: The Runner
93,https://svs.gsfc.nasa.gov/93/,Musculoskeletal Modeling Dynamic Simulations: Walking
94,https://svs.gsfc.nasa.gov/94/,Musculoskeletal Modeling Dynamic Simulations: Jumping
95,https://svs.gsfc.nasa.gov/95/,Musculoskeletal Modeling Dynamic Simulations: Sitting
96,https://svs.gsfc.nasa.gov/96/,The HoloGlobe Project (Version 1)
97,https://svs.gsfc.nasa.gov/97/,Images of Earth and Space: The Role of Visualization in NASA Science
98,https://svs.gsfc.nasa.gov/98/,"Glacier Bay, Alaska, from the Ground, Air and Space"
99,https://svs.gsfc.nasa.gov/99/,Baltimore - Washington: 200 Years of Urban Growth
100,https://svs.gsfc.nasa.gov/100/,Global Distribution of UV-Absorbing Tropospheric Aerosols for 1987
101,https://svs.gsfc.nasa.gov/101/,Annually Occurring Aerosol Features: Biomass Burning in Southern Africa from July to September 1986
102,https://svs.gsfc.nasa.gov/102/,Annually Occurring Aerosol Features: Biomass Burning in South America from Aug. through Sept. 1987
103,https://svs.gsfc.nasa.gov/103/,Transient Aerosol Features: Great China Fire from April through May 1987
104,https://svs.gsfc.nasa.gov/104/,Transient Aerosol Features: Yellowstone Fire from August to September 1988
105,https://svs.gsfc.nasa.gov/105/,Transient Aerosol Features: El Chichon Volcano from March to April 1982
106,https://svs.gsfc.nasa.gov/106/,Transient Aerosol Features: North Atlantic Ocean from March to April 1988
107,https://svs.gsfc.nasa.gov/107/,High Resolution 2-D Numerical Simulation of Emergence of Magnetic Flux Through the Solar Atmosphere
108,https://svs.gsfc.nasa.gov/108/,Assimilation of N2O in the Upper Atmosphere Using a Kalman Filter: N2O Mixing Ratio
109,https://svs.gsfc.nasa.gov/109/,"Increasing Air Traffic Safety, Using Real Time Weather in the Cockpit"
110,https://svs.gsfc.nasa.gov/110/,Images of Earth and Space: Supercomputing 96
111,https://svs.gsfc.nasa.gov/111/,Numerical Simulation of Magnetic Flux Emerging Through a Model Solar Atmosphere: Density
112,https://svs.gsfc.nasa.gov/112/,Numerical Simulation of Magnetic Flux Emerging Through a Model Solar Atmosphere: Density Gradient
113,https://svs.gsfc.nasa.gov/113/,"Numerical Simulation of Magnetic Flux Emerging Through a Model Solar Atmosphere: Density, Magnetic Field, and Mach Number"
114,https://svs.gsfc.nasa.gov/114/,"Numerical Simulation of Magnetic Flux Emerging Through a Model Solar Atmosphere: Density Gradient, Magnetic Field, and Mach Number"
115,https://svs.gsfc.nasa.gov/115/,Numerical Simulation of Magnetic Flux Emerging Through a Model Solar Atmosphere: Density Gradient and Velocities
116,https://svs.gsfc.nasa.gov/116/,The HoloGlobe Project (Version 2)
117,https://svs.gsfc.nasa.gov/117/,Global Hybrid Versus MHD Modeling of the Magnetosphere: Magnetic Potential
119,https://svs.gsfc.nasa.gov/119/,VIS-5D VR Animations: Climate Change
120,https://svs.gsfc.nasa.gov/120/,VIS-5D VR Animations: Hurricane Florence
121,https://svs.gsfc.nasa.gov/121/,3-D Manual Alphabet in VRML
123,https://svs.gsfc.nasa.gov/123/,"Sea Surface Temperature Anomalies Showing the Onslaught of El Niño: Aug. 1, 1996 to Aug. 9, 1997"
124,https://svs.gsfc.nasa.gov/124/,"Sea Surface Height Anomalies Showing the Onslaught of El Niño: August 1, 1996 to August 3, 1997"
125,https://svs.gsfc.nasa.gov/125/,"SST Anomalies and SSW Anomalies Showing the Onslaught of El Niño: Aug 1, 1996 to Aug 9, 1997"
126,https://svs.gsfc.nasa.gov/126/,El Niño: Sea Surface Temperature Anomaly and Sea Surface Height Anomaly from Aug. 1996 to Aug. 1997
127,https://svs.gsfc.nasa.gov/127/,Horizon to full Galaxy
128,https://svs.gsfc.nasa.gov/128/,Atmospheric Chemistry and Dynamics Branch Lead-in
129,https://svs.gsfc.nasa.gov/129/,Visualization of 3D Ozone Data: Nimbus-7 SBUV
130,https://svs.gsfc.nasa.gov/130/,SBUV Daily Profile Ozone: June 1985 - November 1985
131,https://svs.gsfc.nasa.gov/131/,SBUV 2-Day Running Average Profile and Total Ozone: June 1985 - November 1985
132,https://svs.gsfc.nasa.gov/132/,"El Niño: NCEP Sea Surface Temperature Anomaly from August 1, 1996 to August 9, 1997"
133,https://svs.gsfc.nasa.gov/133/,"El Niño: TOPEX/Poseidon Altimeter Sea Level Anomaly from August 1, 1996 to August 3, 1997"
134,https://svs.gsfc.nasa.gov/134/,El Niño: Sea Surface Temperature Anomaly and Sea Surface Wind Anomaly from Aug. 1996 to Aug. 1997
135,https://svs.gsfc.nasa.gov/135/,El Niño: Sea Surface Temperature Anomaly and Sea Surface Height Anomaly from Aug. 1996 to Aug. 1997
136,https://svs.gsfc.nasa.gov/136/,"El Niño: NCEP Sea Surface Temperature Anomaly from September 15, 1996 to September 20, 1997"
137,https://svs.gsfc.nasa.gov/137/,"El Niño: TOPEX/Poseidon Altimeter Sea Level Anomaly from September 15, 1996 to September 21, 1997"
138,https://svs.gsfc.nasa.gov/138/,El Niño: Sea Surface Temperature Anomaly and Sea Surface Wind Anomaly from Sept. 1996 to Sept. 1997
139,https://svs.gsfc.nasa.gov/139/,El Niño: Sea Surface Temperature Anomaly and Sea Surface Height Anomaly from Sept. 1996 to Sept. 1997
140,https://svs.gsfc.nasa.gov/140/,"El Niño: NCEP Sea Surface Temperature Anomaly from September 15, 1996 to September 20, 1997"
141,https://svs.gsfc.nasa.gov/141/,"El Niño: TOPEX/Poseidon Altimeter Sea Level Anomaly from September 15, 1996 to September 21, 1997"
142,https://svs.gsfc.nasa.gov/142/,El Niño: Sea Surface Temperature Anomaly and Sea Surface Wind Anomaly from Sept. 1996 to Sept. 1997
143,https://svs.gsfc.nasa.gov/143/,"El Niño: SST Anomaly, Sea Surface Wind Anomaly, and  SSH Anomaly from Sept 1996 to Sept 1997"
144,https://svs.gsfc.nasa.gov/144/,"El Niño Sea Surface Height, Temperature, Wind, and Precipitation Anomalies: Jan 1997 through Dec 1997"
145,https://svs.gsfc.nasa.gov/145/,El Niño Sea Surface Temperature and Height Anomaly on a Globe: January 1997 through December 1997
146,https://svs.gsfc.nasa.gov/146/,El Niño Sea Surface Temperature Anomaly Comparison: 1982/1983 to 1997
147,https://svs.gsfc.nasa.gov/147/,El Niño Sea Surface Temperature Anomaly Comparison with Zoom: 1982/1983 to 1997
148,https://svs.gsfc.nasa.gov/148/,"El Niño Sea Surface Temperature, Height, and Wind Anomaly Onionskin: Jan. 1997 through Dec. 1997"
149,https://svs.gsfc.nasa.gov/149/,"El Niño Sea Surface Wind, Temperature and Height Anomaly Compilation: Jan. 1997 - Dec. 1997"
150,https://svs.gsfc.nasa.gov/150/,"El Niño Equatorial Fly-by Showing Sea Surface Temp, Height Anomaly on a Globe: Jan through Dec 1997"
151,https://svs.gsfc.nasa.gov/151/,El Niño Zoom to Sea Surface Temperature and Height Anomaly on a Globe: Jan. 1997 through Dec. 1997
152,https://svs.gsfc.nasa.gov/152/,"El Niño Sea Surface Temperature, Height, and Wind Anomalies: Jan. 1997 - Dec. 1997 (Close-up)"
153,https://svs.gsfc.nasa.gov/153/,El Niño Equatorial Fly-by Showing Sea Surface Temp and Height Anomaly on a Globe: Jan. 1997 through Dec. 1997
154,https://svs.gsfc.nasa.gov/154/,"El Niño Sea Surface Height, Temp, Wind, and Precipitation Anomaly Compilation: Jan. 1997 - Dec. 1997"
155,https://svs.gsfc.nasa.gov/155/,The HoloGlobe Project (Version 3)
156,https://svs.gsfc.nasa.gov/156/,"El Niño Sea Surface Temperature Anomaly: January, 1997, through December, 1997"
157,https://svs.gsfc.nasa.gov/157/,"El Niño Sea Surface Height Anomaly: January, 1997, through December, 1997"
158,https://svs.gsfc.nasa.gov/158/,El Niño Sea Surface Wind Anomaly: January 1997 through October 1997
159,https://svs.gsfc.nasa.gov/159/,"El Niño Sea Surface Temperature, Height, and Wind Anomalies: January 1997 - December 1997"
160,https://svs.gsfc.nasa.gov/160/,"El Niño Sea Surface Temperature, Height, and Wind Anomaly Onionskin: Jan. 1997 - Dec. 1997"
161,https://svs.gsfc.nasa.gov/161/,El Niño Sea Surface Height and Temp Anomalies Wrapped to a Globe: Jan. 1997 through Dec. 1997
162,https://svs.gsfc.nasa.gov/162/,"El Niño Sea Surface Temp, Height, and Wind Anomalies: Jan. 1997 - Dec. 1997 (Close-Up)"
163,https://svs.gsfc.nasa.gov/163/,El Niño Sea Surface Temperature Anomaly Comparison: 1982/1983 to 1997
164,https://svs.gsfc.nasa.gov/164/,"El Niño Sea Surface Height, Temp, Wind, and Precipitation Anomalies: Jan. 1997 - Dec. 1997"
165,https://svs.gsfc.nasa.gov/165/,SeaWiFS Chesapeake Bay Zoom in
166,https://svs.gsfc.nasa.gov/166/,SeaWiFS Data Swaths Phytoplankton Concentration
167,https://svs.gsfc.nasa.gov/167/,SeaWiFS East Coast Zoom
168,https://svs.gsfc.nasa.gov/168/,SeaWiFS Galapagos Island Zoom Showing Before and During El Niño
169,https://svs.gsfc.nasa.gov/169/,SeaWiFS True Color Phytoplankton Concentration Global Biosphere
170,https://svs.gsfc.nasa.gov/170/,SeaWiFS Indonesian Smoke
171,https://svs.gsfc.nasa.gov/171/,Landsat Bolivian Deforestation: 1984 to 1998
172,https://svs.gsfc.nasa.gov/172/,GOES Water Vapor: 1995 Hurricane Season
173,https://svs.gsfc.nasa.gov/173/,Typhoon Opal
174,https://svs.gsfc.nasa.gov/174/,TRMM Data Swath
175,https://svs.gsfc.nasa.gov/175/,TRMM Data Swath Close-up View (TRMM Ride)
176,https://svs.gsfc.nasa.gov/176/,TRMM Data Swath Revealing Cloud Interior
177,https://svs.gsfc.nasa.gov/177/,Global Precipitation Anomalies: 1900-1988
178,https://svs.gsfc.nasa.gov/178/,United States Precipitation Anomalies: 1900-1988
179,https://svs.gsfc.nasa.gov/179/,Precipitation Trends: 1900-1988
180,https://svs.gsfc.nasa.gov/180/,Milky Way Observatory
181,https://svs.gsfc.nasa.gov/181/,Milky Way Antimatter Plume
182,https://svs.gsfc.nasa.gov/182/,Positron-electron Annihilation
183,https://svs.gsfc.nasa.gov/183/,EOS - AM1 Beauty Shot
184,https://svs.gsfc.nasa.gov/184/,"Houston Storm TRMM Flyover: February 10, 1998"
185,https://svs.gsfc.nasa.gov/185/,"Cyclone Susan TRMM Flyover: January 7, 1998"
186,https://svs.gsfc.nasa.gov/186/,"Daily Lightning Measurements from TRMM: April 1, 1998 through April 29, 1998"
187,https://svs.gsfc.nasa.gov/187/,"Cumulative Lightning Measurements from TRMM: April 1, 1998 through April 29, 1998"
188,https://svs.gsfc.nasa.gov/188/,"Monthly Average Lightning Measurements from TRMM: January, 1998 through April, 1998"
189,https://svs.gsfc.nasa.gov/189/,"Average Global Lightning from TRMM for April, 1998"
190,https://svs.gsfc.nasa.gov/190/,Slice through Cyclone Susan - TRMM Infrared and Precipitation Radar Data
191,https://svs.gsfc.nasa.gov/191/,Houston Storm from TRMM: Precipitation Radar Data
192,https://svs.gsfc.nasa.gov/192/,Houston Storm from TRMM: Infrared and Precipitation Radar Data
193,https://svs.gsfc.nasa.gov/193/,Fly up to Houston Storm using TRMM Precipitation Radar and Infrared Data
194,https://svs.gsfc.nasa.gov/194/,Slice through a Houston Storm using TRMM Data
195,https://svs.gsfc.nasa.gov/195/,TRMM Precipitation Radar Measurements of a Houston Storm
196,https://svs.gsfc.nasa.gov/196/,Global Precipitation from SSMI: January 1997 through May 1998
197,https://svs.gsfc.nasa.gov/197/,Global Precipitation Anomaly from SSMI: January 1997 through May 1998
198,https://svs.gsfc.nasa.gov/198/,Slice Through a Houston Storm Using TRMM Data (Second Version)
199,https://svs.gsfc.nasa.gov/199/,"El Niño Sea Surface Wind, Temperature and Height Anomaly Compilation: June 1997 through June 1998"
200,https://svs.gsfc.nasa.gov/200/,El Niño Sea Surface Temperature Anomaly Comparison: 1982/1983 to 1997/1998
201,https://svs.gsfc.nasa.gov/201/,El Niño Sea Surface Temperature Anomaly Comparison with Zoom: 1982/1983 to 1997/1998
202,https://svs.gsfc.nasa.gov/202/,El Niño Sea Surface Temperature and Height Anomaly on a Globe: June 1997 through June 1998
203,https://svs.gsfc.nasa.gov/203/,El Niño Zoom to Cross-section of Temperature and Height Anomalies: June 1997 through June 1998
204,https://svs.gsfc.nasa.gov/204/,El Niño Zoom to Cross-section of Temperature and Height Anomalies: June 1997 through June 1998
205,https://svs.gsfc.nasa.gov/205/,SeaWIFS Phytoplankton around the Galapagos Islands in May 1998
206,https://svs.gsfc.nasa.gov/206/,El Niño Monthly Sea Surface Temperature Anomaly Stills: June 1997 through June 1998
207,https://svs.gsfc.nasa.gov/207/,SeaWiFS Phytoplankton in the Pacific: September 1997 through May 1998
208,https://svs.gsfc.nasa.gov/208/,Sea Surface Temperature-Phytoplankton Correlation around the Galapagos in May 1998
209,https://svs.gsfc.nasa.gov/209/,"Hurricane Bonnie from TRMM: August 22, 1998"
210,https://svs.gsfc.nasa.gov/210/,"Hurricane Bonnie from TRMM: August 25, 1998"
211,https://svs.gsfc.nasa.gov/211/,"Hurricane Bonnie from TRMM and GOES with Cloud Tower: August 22, 1998"
212,https://svs.gsfc.nasa.gov/212/,"Hurricane Earl from TRMM: September 2, 1998"
213,https://svs.gsfc.nasa.gov/213/,"TRMM Hurricane Alley: September 2, 1998"
214,https://svs.gsfc.nasa.gov/214/,"Hurricane Georges from TRMM: September 23, 1998"
215,https://svs.gsfc.nasa.gov/215/,"Hurricane Georges from TRMM: September 24, 1998"
216,https://svs.gsfc.nasa.gov/216/,"Hurricane Georges from TRMM: September 27, 1998"
217,https://svs.gsfc.nasa.gov/217/,"Hurricane Georges (SeaWiFS 3 images) September 27, 1998 1:57 p.m."
218,https://svs.gsfc.nasa.gov/218/,"SeaWiFS Hurricane Georges September 27, 1998"
219,https://svs.gsfc.nasa.gov/219/,"Final SeaWiFS Image of Hurricane Georges September 27, 1998"
220,https://svs.gsfc.nasa.gov/220/,"Hurricane Mitch from TRMM: October 27, 1998"
221,https://svs.gsfc.nasa.gov/221/,"Hurricane Mitch from TRMM: October 27, 1998 with Two Surfaces"
222,https://svs.gsfc.nasa.gov/222/,"Hurricane Bonnie from TRMM with Cloud Tower: August 22, 1998 (Long Version)"
223,https://svs.gsfc.nasa.gov/223/,"Hurricane Linda from GOES: September 11, 1997 (Zoom In)"
224,https://svs.gsfc.nasa.gov/224/,"Hurricane Linda from GOES: September 11, 1997 (Zoom In and Rotate)"
225,https://svs.gsfc.nasa.gov/225/,"Hurricane Linda from GOES: September 11, 1997 (Fly Across)"
226,https://svs.gsfc.nasa.gov/226/,"Hurricane Mitch from GOES: October 27, 1998"
227,https://svs.gsfc.nasa.gov/227/,"Hurricane Bonnie from TRMM with Cloud Tower: August 22, 1998 (Short Version)"
228,https://svs.gsfc.nasa.gov/228/,TAO-TRITON Array: Sphere View with Push
229,https://svs.gsfc.nasa.gov/229/,TAO-TRITON Array: Sphere View without Push
230,https://svs.gsfc.nasa.gov/230/,TAO-TRITON Array: Flat View without Push
231,https://svs.gsfc.nasa.gov/231/,TAO-TRITON Array: Multi-animations of Buoy Locations
232,https://svs.gsfc.nasa.gov/232/,"Total Ozone over Antarctica from TOMS: Jul 1, 1998 through Oct 1, 1998 (Rotation to Pole with Dates)"
233,https://svs.gsfc.nasa.gov/233/,"Total Ozone over Antarctica from TOMS: July 1, 1998 through October 1, 1998 (With Dates)"
234,https://svs.gsfc.nasa.gov/234/,"Total Ozone over Antarctica from TOMS: Jul 1, 1998 through Oct 1, 1998 Rotation to Pole without Dates"
235,https://svs.gsfc.nasa.gov/235/,"Total Ozone over Antarctica from TOMS: July 1, 1998 through October 1, 1998 (Without Dates)"
236,https://svs.gsfc.nasa.gov/236/,Average September Ozone Levels over Antarctica for 1979 to 1998
237,https://svs.gsfc.nasa.gov/237/,"Zoom in to Florida: June 17, 1998"
238,https://svs.gsfc.nasa.gov/238/,"Flyover of Florida: June 17, 1998"
239,https://svs.gsfc.nasa.gov/239/,"Zoom in to Florida: June 22, 1998"
240,https://svs.gsfc.nasa.gov/240/,"Flyover of Florida: June 22, 1998"
241,https://svs.gsfc.nasa.gov/241/,"Second Flyover of Florida: June 22, 1998"
242,https://svs.gsfc.nasa.gov/242/,"Third Flyover of Florida: June 22, 1998"
243,https://svs.gsfc.nasa.gov/243/,"Second Zoom in to Florida: June 22, 1998"
244,https://svs.gsfc.nasa.gov/244/,"Flyover of Washington State: July 29, 1998"
245,https://svs.gsfc.nasa.gov/245/,"Mexico to East Coast Flyover: May 16, 1998"
246,https://svs.gsfc.nasa.gov/246/,"Yucatan Fires: June 5, 1998"
247,https://svs.gsfc.nasa.gov/247/,"Zoom into the Southern California Fires: October 5, 1998"
248,https://svs.gsfc.nasa.gov/248/,"Close up of Southern California Fires: October 5, 1998"
249,https://svs.gsfc.nasa.gov/249/,"Flyover and Zoom to Yangtze Floods: August 4, 1998"
250,https://svs.gsfc.nasa.gov/250/,"Flyover of Songhua Floods: August 20, 1998"
251,https://svs.gsfc.nasa.gov/251/,Images of Earth and Space: SC97 Edition
252,https://svs.gsfc.nasa.gov/252/,"El Niño and La Niña Sea Surface Temperature, Height, and Wind Anomalies: Jan. 1997 through Aug. 1998"
253,https://svs.gsfc.nasa.gov/253/,"El Niño-La Niña Sea Surface Temp, Height, and Wind Anomalies: Jan. 1997 through Aug. 1998 (Close-up)"
254,https://svs.gsfc.nasa.gov/254/,El Niño-La Niña Sea Surface Temperature Anomaly Comparison with Zoom: 1982/1983 to 1997/1998
255,https://svs.gsfc.nasa.gov/255/,El Niño Zoom to Cross-section of Temperature and Height Anomalies: August 1997 through August 1998
256,https://svs.gsfc.nasa.gov/256/,El Niño Sea Surface Temperature and Height Anomaly 3D Side View: January 1997 through July 1998
257,https://svs.gsfc.nasa.gov/257/,"La Niña Sea Surface Temperature, Height, and Wind Anomaly Onionskin: Jan. 1997 through Aug. 1998"
258,https://svs.gsfc.nasa.gov/258/,El Niño Sea Surface Temperature and Height Anomaly on a Globe: January 1997 through August 1998
259,https://svs.gsfc.nasa.gov/259/,Global Methane Isosurface Wave
260,https://svs.gsfc.nasa.gov/260/,El Niño Zoom to Cross-section of Temperature and Height Anomalies: July 1997 through August 1998
261,https://svs.gsfc.nasa.gov/261/,El Niño Sea Surface Temperature Anomaly: January 1997 through August 1998
262,https://svs.gsfc.nasa.gov/262/,El Niño Sea Surface Height Anomaly: January 1997 through August 1998
263,https://svs.gsfc.nasa.gov/263/,El Niño-La Niña Sea Surface Temperature and Height Anomalies: January 1997 through August 1998
264,https://svs.gsfc.nasa.gov/264/,El Niño-La Niña Sea Surface Temp and Height Anomalies 3D Isometric View: Jan. 1997 through Aug. 1998
265,https://svs.gsfc.nasa.gov/265/,El Niño-La Niña Sea Surface Temp and Height Anomalies 3D Isometric View with Pan: Jan 1997 through Aug 1998
266,https://svs.gsfc.nasa.gov/266/,El Niño-La Niña Sea Surface Temperature and Height Anomalies Side View: Jan. 1997 through Aug. 1998
267,https://svs.gsfc.nasa.gov/267/,El Niño-La Niña Sea Surface Temperature Anomaly Comparison: 1982/1983 to 1997/1998
268,https://svs.gsfc.nasa.gov/268/,El Niño Sea Surface Temperature Anomaly: January 1997 through July 1998
269,https://svs.gsfc.nasa.gov/269/,El Niño Sea Surface Height Anomaly: January 1997 through July 1998
270,https://svs.gsfc.nasa.gov/270/,El Niño Sea Surface Temperature and Height Anomalies: January 1997 through July 1998
