ID,URL,Title
10221,https://svs.gsfc.nasa.gov/10221/,Wide Field Camera 3: Seeing in Different Wavelengths (with labels)
10222,https://svs.gsfc.nasa.gov/10222/,Wide Field Camera 3: Redshift
10223,https://svs.gsfc.nasa.gov/10223/,Cosmic Origins Spectrograph: Large Scale Structure of the Universe
10224,https://svs.gsfc.nasa.gov/10224/,HST Advance Camera For Surveys Repair Scenario
10225,https://svs.gsfc.nasa.gov/10225/,HST Advance Camera For Surveys Power Flow
10226,https://svs.gsfc.nasa.gov/10226/,HST SM4 Orbital Replacement Unit Carrier - ORUC
10227,https://svs.gsfc.nasa.gov/10227/,HST SM4 Multi-Use Lightweight Equipment Carrier (MULE)
10228,https://svs.gsfc.nasa.gov/10228/,HST SM4 Super Lightweight Instrument Carrier (SLIC)
10229,https://svs.gsfc.nasa.gov/10229/,HST SM4 ACS Repair EVA
10230,https://svs.gsfc.nasa.gov/10230/,HST SM4 STIS Repair EVA
10231,https://svs.gsfc.nasa.gov/10231/,HST SM4 Battery Module Replacement EVA
10232,https://svs.gsfc.nasa.gov/10232/,HST SM4 COS Installation EVA
10233,https://svs.gsfc.nasa.gov/10233/,HST SM4 WFC3 Installation EVA
10234,https://svs.gsfc.nasa.gov/10234/,HST SM4 RSU / Gyroscope Replacement EVA
10235,https://svs.gsfc.nasa.gov/10235/,HST SM4 Hubble Deploy
10236,https://svs.gsfc.nasa.gov/10236/,NASA On Air: NASA Models CO2 Plumes - North America (11/25/2014)
10237,https://svs.gsfc.nasa.gov/10237/,HST SM4 — Astronauts Close HST Doors for Last Time
10238,https://svs.gsfc.nasa.gov/10238/,HST SM4 Countdown Status 1
10239,https://svs.gsfc.nasa.gov/10239/,Enter NASA's Spacecraft Chamber of Horrors
10240,https://svs.gsfc.nasa.gov/10240/,CATS: Crew Aids and Tools
10241,https://svs.gsfc.nasa.gov/10241/,HST Operations at GSFC - STOCC2
10242,https://svs.gsfc.nasa.gov/10242/,Goddard Space Flight Center Divers
10243,https://svs.gsfc.nasa.gov/10243/,HST SM4 Crew Training at NASA Goddard
10244,https://svs.gsfc.nasa.gov/10244/,Hubble Servicing Mission Movie Trailer 1
10246,https://svs.gsfc.nasa.gov/10246/,STS-125 Launch for Hubble Servicing Mission 4
10247,https://svs.gsfc.nasa.gov/10247/,GLASTcast Episode 1:  What is GLAST?
10248,https://svs.gsfc.nasa.gov/10248/,GLASTcast Episode 2:  What are Gamma Rays?
10249,https://svs.gsfc.nasa.gov/10249/,LRO L-14 Press Conference Supporting Videos
10250,https://svs.gsfc.nasa.gov/10250/,GLASTcast for iTunes
10251,https://svs.gsfc.nasa.gov/10251/,"GLAST Prelude, for Brass Quintet, Op.12"
10252,https://svs.gsfc.nasa.gov/10252/,GOES-O Ready to Launch!
10253,https://svs.gsfc.nasa.gov/10253/,Scientists Watch Baby Black Hole Get to Work Fast
10254,https://svs.gsfc.nasa.gov/10254/,LRO - The Next Step
10255,https://svs.gsfc.nasa.gov/10255/,Exploring Ozone
10256,https://svs.gsfc.nasa.gov/10256/,Instagram: Bennu's Journey
10257,https://svs.gsfc.nasa.gov/10257/,Return with LRO
10258,https://svs.gsfc.nasa.gov/10258/,The Future Arrives
10259,https://svs.gsfc.nasa.gov/10259/,Vision. Hope. Triumph.
10260,https://svs.gsfc.nasa.gov/10260/,IBEX: Exploring The Edge Of Our Solar System
10261,https://svs.gsfc.nasa.gov/10261/,"Hello, SDO"
10262,https://svs.gsfc.nasa.gov/10262/,"GSFC: 'Critical Space Item, Handle with Extreme Care'"
10263,https://svs.gsfc.nasa.gov/10263/,Resonant Dust Ring Sculpted by a Super-Earth
10264,https://svs.gsfc.nasa.gov/10264/,Earth Science Week 2008
10266,https://svs.gsfc.nasa.gov/10266/,"Wide Field Camera 3: Extending Hubble's Vision, Packed with Power"
10268,https://svs.gsfc.nasa.gov/10268/,Glory's Aerosol Polarimetry Sensor Taking Polarimetric Measurements
10269,https://svs.gsfc.nasa.gov/10269/,LRO - Animation Stills (High Resolution)
10270,https://svs.gsfc.nasa.gov/10270/,Cosmic Origins Spectrograph - Exploring Physics Across the Universe
10271,https://svs.gsfc.nasa.gov/10271/,HST SM4 - Change Out Animation
10272,https://svs.gsfc.nasa.gov/10272/,Women@NASA 2014
10273,https://svs.gsfc.nasa.gov/10273/,NASA On Air: NASA’s Carbon Dioxide Plumes - World Map (11/21/2014)
10274,https://svs.gsfc.nasa.gov/10274/,Need To Know: Sample Analysis at Mars Findings
10275,https://svs.gsfc.nasa.gov/10275/,Footage from NASAs Independent Verification and Validation Facility (IV&V)
10276,https://svs.gsfc.nasa.gov/10276/,Beautiful Earth with GPM
10277,https://svs.gsfc.nasa.gov/10277/,Nimbus 50th Anniversary Celebration
10278,https://svs.gsfc.nasa.gov/10278/,NASA's Fermi Helps Scientists Study Gamma-ray Thunderstorms
10279,https://svs.gsfc.nasa.gov/10279/,NASA On Air: NASA Tracks Amazon Plume and Ocean Salinity (12/11/2014)
10280,https://svs.gsfc.nasa.gov/10280/,Vegetation Response to Lower Colorado River pulse flow in 2014
10281,https://svs.gsfc.nasa.gov/10281/,Instagram: Arctic Absorbing More Energy From The Sun
10287,https://svs.gsfc.nasa.gov/10287/,"Get Ready for the August 1, 2008 Total Solar Eclipse"
10288,https://svs.gsfc.nasa.gov/10288/,Wall*E Learns About Proportions
10289,https://svs.gsfc.nasa.gov/10289/,Rain Rain Go Away Come Again on a Work Day?
10318,https://svs.gsfc.nasa.gov/10318/,HST SM4 Extended Resource Reel v2.0
10319,https://svs.gsfc.nasa.gov/10319/,Swift - Print Still Images - Wallpaper
10321,https://svs.gsfc.nasa.gov/10321/,HST SM4 Resource Reel v2.0
10322,https://svs.gsfc.nasa.gov/10322/,GLAST Soundbites
10323,https://svs.gsfc.nasa.gov/10323/,GLASTCast Episode 3 - Swift and GLAST
10324,https://svs.gsfc.nasa.gov/10324/,GLASTcast Episode 4: Launching a Spacecraft
10325,https://svs.gsfc.nasa.gov/10325/,GLASTcast Episode 5: Meet the U.S. Team
10326,https://svs.gsfc.nasa.gov/10326/,Assembly of the Lunar Reconnaissance Orbiter (LRO)
10327,https://svs.gsfc.nasa.gov/10327/,Astronaut Touches Hubble Animation
10328,https://svs.gsfc.nasa.gov/10328/,Fine Guidance Sensor Installation EVA Animation
10329,https://svs.gsfc.nasa.gov/10329/,HST SM4 Rendezvous and Capture Sequence
10330,https://svs.gsfc.nasa.gov/10330/,New Outer Blanket Layer (NOBL) Installation EVA Animation
10331,https://svs.gsfc.nasa.gov/10331/,In The Zone
10332,https://svs.gsfc.nasa.gov/10332/,Solar Neutral Particles
10333,https://svs.gsfc.nasa.gov/10333/,The Cloud Makers
10334,https://svs.gsfc.nasa.gov/10334/,"LRO/LCROSS Launch, Deploy, and Mission Animation"
10335,https://svs.gsfc.nasa.gov/10335/,The Atlas V Rocket Is Readied
10336,https://svs.gsfc.nasa.gov/10336/,Star Trackers Light the Way
10337,https://svs.gsfc.nasa.gov/10337/,JWST Deployment and Beauty Animations
10338,https://svs.gsfc.nasa.gov/10338/,Looking Back at 2003s Spooky Halloween Solar Storms
10339,https://svs.gsfc.nasa.gov/10339/,The Puffin-Satellite Connection
10340,https://svs.gsfc.nasa.gov/10340/,Cross Calibration of the Afternoon Constellation's Instruments
10341,https://svs.gsfc.nasa.gov/10341/,BEST: Engineering Design Process Professional Development Series
10342,https://svs.gsfc.nasa.gov/10342/,Ionosphere and CINDI
10343,https://svs.gsfc.nasa.gov/10343/,Up to the Challenge
10344,https://svs.gsfc.nasa.gov/10344/,Fermi LAT movie of Gamma-ray Burst (GRB) 080916C
10345,https://svs.gsfc.nasa.gov/10345/,GLASTcast in HD for Apple TV and iTunes
10346,https://svs.gsfc.nasa.gov/10346/,The Last Mission to Hubble
10347,https://svs.gsfc.nasa.gov/10347/,GLAST First Light All Sky Map
10348,https://svs.gsfc.nasa.gov/10348/,ACS Repair: The Challenge to Fix Hubble's Best Survey Camera
10349,https://svs.gsfc.nasa.gov/10349/,LRO Scouts for Safe Landing Sites (Narrated)
10350,https://svs.gsfc.nasa.gov/10350/,STIS Repair: The Quest for Renewed Exploration
10351,https://svs.gsfc.nasa.gov/10351/,Launch and Deployment of IBEX
10352,https://svs.gsfc.nasa.gov/10352/,NASA Sees Holiday Lights from Space
10353,https://svs.gsfc.nasa.gov/10353/,Sea Ice 2008
10354,https://svs.gsfc.nasa.gov/10354/,CNOFS beauty pass
10355,https://svs.gsfc.nasa.gov/10355/,THEMIS discovers biggest breach of Earth's solar storm shield
10356,https://svs.gsfc.nasa.gov/10356/,THEMIS Discovers Biggest Breach of Earth's Magnetosphere
10357,https://svs.gsfc.nasa.gov/10357/,GLASTcast Episode 6: 2008 Mission Update
10358,https://svs.gsfc.nasa.gov/10358/,Geochemical Creation of Methane
10359,https://svs.gsfc.nasa.gov/10359/,Biological Creation of Methane
10360,https://svs.gsfc.nasa.gov/10360/,Mars Methane Spectroscopy
10361,https://svs.gsfc.nasa.gov/10361/,Pulsars Emit Gamma-rays from Equator
10362,https://svs.gsfc.nasa.gov/10362/,Radiolytic Production of Methane by Microbial Life
10363,https://svs.gsfc.nasa.gov/10363/,The Mystery of Martian Methane
10364,https://svs.gsfc.nasa.gov/10364/,NOAA-N Prime Mission Overview
10365,https://svs.gsfc.nasa.gov/10365/,SLIC: The Unsung Hero of Servicing Mission 4
10366,https://svs.gsfc.nasa.gov/10366/,Soft Gamma-Ray Repeater Light Echoes Captured by Swift Satellite
10367,https://svs.gsfc.nasa.gov/10367/,Launchfest: On the Goddard Mall
10369,https://svs.gsfc.nasa.gov/10369/,Naked-Eye Gamma-ray Burst Model for GRB 080319B
10370,https://svs.gsfc.nasa.gov/10370/,John Mather Lecture Presentation
10371,https://svs.gsfc.nasa.gov/10371/,Climate Change and Polar Ice: Are We Waking Sleeping Giants w/ Dr. Waleed Abdalati
10372,https://svs.gsfc.nasa.gov/10372/,NOAA-N Prime and GOES-O in Orbit Animation
10374,https://svs.gsfc.nasa.gov/10374/,Spitzer Exoplanet Observation of HD 80606b
10375,https://svs.gsfc.nasa.gov/10375/,Glory Podcast Opener
10376,https://svs.gsfc.nasa.gov/10376/,LRO's Team Spirit with Joanne Baker
10377,https://svs.gsfc.nasa.gov/10377/,Black History Month 2009
10378,https://svs.gsfc.nasa.gov/10378/,"LRO Interview: Rich Vondrak, Project Scientist"
10379,https://svs.gsfc.nasa.gov/10379/,Glory Launch Sequence
10380,https://svs.gsfc.nasa.gov/10380/,Two Glory Beauty Passes
10381,https://svs.gsfc.nasa.gov/10381/,25 Years of Landsat 5: 1984 Las Vegas Urban Expansion
10382,https://svs.gsfc.nasa.gov/10382/,Glory Solar Array Deployment
10383,https://svs.gsfc.nasa.gov/10383/,Glory Instrument Flyover
10384,https://svs.gsfc.nasa.gov/10384/,Glory's Total Irradiance Monitor (TIM)
10385,https://svs.gsfc.nasa.gov/10385/,Welcome
10386,https://svs.gsfc.nasa.gov/10386/,Sources of Aerosols
10387,https://svs.gsfc.nasa.gov/10387/,Aerosols Impact Cloud Formation
10388,https://svs.gsfc.nasa.gov/10388/,Human Induced versus Naturally Occurring Aerosols
10389,https://svs.gsfc.nasa.gov/10389/,Aerosols Absorb; Aerosols Reflect
10390,https://svs.gsfc.nasa.gov/10390/,Sea Salt Aerosols
10391,https://svs.gsfc.nasa.gov/10391/,Potassium Aerosols
10392,https://svs.gsfc.nasa.gov/10392/,Volcanic Ash Still Image
10393,https://svs.gsfc.nasa.gov/10393/,Soot and Sulfate Still Images and Video of Tractor Soot Particle
10394,https://svs.gsfc.nasa.gov/10394/,Scanning Electron Microscope Still Image of Pollen Particles
10395,https://svs.gsfc.nasa.gov/10395/,Earth's Energy Budget Animations: Global View and Budget Breakout
10396,https://svs.gsfc.nasa.gov/10396/,Solar Variability and Total Solar Irradiance (TSI)
10397,https://svs.gsfc.nasa.gov/10397/,City and Traffic Timelapses
10398,https://svs.gsfc.nasa.gov/10398/,USGS Video of a Hawaiian Volcano
10399,https://svs.gsfc.nasa.gov/10399/,"Glory Cleanroom B-roll, Orbital Sciences Corporation"
10400,https://svs.gsfc.nasa.gov/10400/,50 Years of Goddard
10401,https://svs.gsfc.nasa.gov/10401/,Earth Observing Landsat 5 Turns 25 Years Old
10402,https://svs.gsfc.nasa.gov/10402/,"Rain, Drought, Urbanization Contributing Factors for Storms"
10403,https://svs.gsfc.nasa.gov/10403/,FROZEN: A Spherical Movie About the Cryosphere
10405,https://svs.gsfc.nasa.gov/10405/,The Moon - Resources for Finding High-Res Stills
10406,https://svs.gsfc.nasa.gov/10406/,GEMS X-Ray Detector Animation
10407,https://svs.gsfc.nasa.gov/10407/,"Fermi All-sky Movie Shows Flaring, Fading Blazars"
10408,https://svs.gsfc.nasa.gov/10408/,LRO - Assembly and Testing Stills (High Res)
10409,https://svs.gsfc.nasa.gov/10409/,Sun-Earth Day 2009 Promos
10410,https://svs.gsfc.nasa.gov/10410/,LRO Ships Out from Goddard Space Flight Center
10411,https://svs.gsfc.nasa.gov/10411/,The Top 5 Solar Discoveries
10412,https://svs.gsfc.nasa.gov/10412/,Return to P.I.G.
10413,https://svs.gsfc.nasa.gov/10413/,GOES Spacecraft Animations and Print Still Images
10414,https://svs.gsfc.nasa.gov/10414/,Greenland Ice Flights
10415,https://svs.gsfc.nasa.gov/10415/,"LRO's CRaTER: Man, On The Moon"
10416,https://svs.gsfc.nasa.gov/10416/,Guided Tour of LIMA Flyover
10417,https://svs.gsfc.nasa.gov/10417/,Yuri's Night 2009
10419,https://svs.gsfc.nasa.gov/10419/,New Sea Ice Findings Cap Year of Focus on Poles
10420,https://svs.gsfc.nasa.gov/10420/,HST SI C&DH EVA Animation
10421,https://svs.gsfc.nasa.gov/10421/,SOHO/TRACE Intro
10422,https://svs.gsfc.nasa.gov/10422/,GOES-O Mission Overview Video
10423,https://svs.gsfc.nasa.gov/10423/,SI C&DH Cleanroom B-roll
10424,https://svs.gsfc.nasa.gov/10424/,HST Space Telescope Operations Control Center B-roll
10425,https://svs.gsfc.nasa.gov/10425/,Testing of the Lunar Reconnaissance Orbiter (LRO)
10426,https://svs.gsfc.nasa.gov/10426/,Vela Pulsar in Gamma Rays
10427,https://svs.gsfc.nasa.gov/10427/,Noctilucent Clouds A capella Music Video
10428,https://svs.gsfc.nasa.gov/10428/,Earth Day 2009 with Kenji Williams
10429,https://svs.gsfc.nasa.gov/10429/,"LRO Interview: John Keller, Deputy Project Scientist"
10430,https://svs.gsfc.nasa.gov/10430/,"LRO Interview: Cathy Peddie, Deputy Project Manager"
10432,https://svs.gsfc.nasa.gov/10432/,Apollo Mission Lunar Surface Footage
10433,https://svs.gsfc.nasa.gov/10433/,"LRO Interview: Craig Tooley, Project Manager"
10434,https://svs.gsfc.nasa.gov/10434/,Earth Observatory 10 Year Anniversary
10435,https://svs.gsfc.nasa.gov/10435/,Hubble SM4 Launch Highlights
10436,https://svs.gsfc.nasa.gov/10436/,Making Hubble More Powerful
10437,https://svs.gsfc.nasa.gov/10437/,Inside Hubble's Control Room During a Spacewalk
10438,https://svs.gsfc.nasa.gov/10438/,LRO: Mapping Our Future
10439,https://svs.gsfc.nasa.gov/10439/,Senator Mikulski Celebrates Hubble Success
10440,https://svs.gsfc.nasa.gov/10440/,Goddard Space Flight Center (1976)
10441,https://svs.gsfc.nasa.gov/10441/,SDO's Science
10442,https://svs.gsfc.nasa.gov/10442/,Wall*E meets the Digital Learning Network
10443,https://svs.gsfc.nasa.gov/10443/,Lunar Reconnaissance Orbiter (LRO) Launch Videos
10444,https://svs.gsfc.nasa.gov/10444/,LRO Enters Lunar Orbit (full live event)
10445,https://svs.gsfc.nasa.gov/10445/,LRO Enters Lunar Orbit (Highlights)
10446,https://svs.gsfc.nasa.gov/10446/,Employees with 40+ Years at Goddard
10447,https://svs.gsfc.nasa.gov/10447/,Flyover of the First Images from the Lunar Reconnaissance Orbiter Camera
10448,https://svs.gsfc.nasa.gov/10448/,GOES-O: Days Before Launch
10449,https://svs.gsfc.nasa.gov/10449/,GOES-O: Behind The Scenes With a Rocket Scientist
10450,https://svs.gsfc.nasa.gov/10450/,GOES-O: Countdown To Launch
10451,https://svs.gsfc.nasa.gov/10451/,NASA Releases Preview Partially Restored Apollo 11 Video
10452,https://svs.gsfc.nasa.gov/10452/,"July 22, 2009  Total Solar Eclipse"
10453,https://svs.gsfc.nasa.gov/10453/,Apollo 11 40th Anniversary: Partially Restored Video of Neil Armstrong Making His Way to the Lunar Surface
10454,https://svs.gsfc.nasa.gov/10454/,Apollo 11 40th Anniversary: Partially Restored Video of Buzz Aldrin Following Neil Armstrong Down the Lunar Module Ladder
10455,https://svs.gsfc.nasa.gov/10455/,Apollo 11 40th Anniversary: Partially Restored Video of Astronauts Buzz Aldrin and Neil Armstrong Unveil the Commemorative Plaque
10456,https://svs.gsfc.nasa.gov/10456/,Apollo 11 40th Anniversary: Partially Restored Video of Neil Armstrong's Television Panorama
10457,https://svs.gsfc.nasa.gov/10457/,Apollo 11 40th Anniversary: Partially Restored Video of Neil Armstrong Photographs Buzz Aldrin Setting Up a Solar Wind Collector
10458,https://svs.gsfc.nasa.gov/10458/,Apollo 11 40th Anniversary: Partially Restored Video of Raising the American Flag
10459,https://svs.gsfc.nasa.gov/10459/,Apollo 11 40th Anniversary: Partially Restored Video of Buzz Aldrin Walking and Running
10460,https://svs.gsfc.nasa.gov/10460/,Apollo 11 40th Anniversary: Partially Restored Video of the Astronauts Talking with President Nixon
10461,https://svs.gsfc.nasa.gov/10461/,Apollo 11 40th Anniversary: Partially Restored Video of Buzz Aldrin Kicking Moon Dust
10462,https://svs.gsfc.nasa.gov/10462/,Apollo 11 40th Anniversary: Partially Restored Video of Buzz Aldrin Carrying Experiment Packages
10463,https://svs.gsfc.nasa.gov/10463/,Apollo 11 40th Anniversary: Partially Restored Video of Buzz Aldrin Hammering a Core Sample Tube into the Moon's Surface
10464,https://svs.gsfc.nasa.gov/10464/,Apollo 11 40th Anniversary: Partially Restored Video of Buzz Aldrin Entering the LM after an EVA
10465,https://svs.gsfc.nasa.gov/10465/,Apollo 11 40th Anniversary: Partially Restored Video of Astronauts Storing Rock Samples into the LM
10466,https://svs.gsfc.nasa.gov/10466/,Apollo 11 40th Anniversary: Partially Restored Video of Neil Armstrong Climbing the Ladder After the Three Hour EVA
10467,https://svs.gsfc.nasa.gov/10467/,Apollo 11 40th Anniversary: Never Before Seen Video of Astronauts Jettisoning Backpacks
10468,https://svs.gsfc.nasa.gov/10468/,Journey to Galapagos
10469,https://svs.gsfc.nasa.gov/10469/,LRO Launch - More Views
10470,https://svs.gsfc.nasa.gov/10470/,"Interstellar ""Wind"" Sculpts Dusty Disks Around Stars"
10471,https://svs.gsfc.nasa.gov/10471/,SDO Engineers Create What Never Was
10472,https://svs.gsfc.nasa.gov/10472/,NASA/NOAA GOES-14: First Full Disk Image
10473,https://svs.gsfc.nasa.gov/10473/,The Hubble Legacy: A Collegiate Case Study
10474,https://svs.gsfc.nasa.gov/10474/,Hubble Career Profiles
10475,https://svs.gsfc.nasa.gov/10475/,LRO Moon Party
10476,https://svs.gsfc.nasa.gov/10476/,G2009-080 SDO Moves Out
10477,https://svs.gsfc.nasa.gov/10477/,LARGEST: A Spherical Movie About Jupiter
10479,https://svs.gsfc.nasa.gov/10479/,A Tour of the LRO Instrument Suite
10480,https://svs.gsfc.nasa.gov/10480/,GRACE Beauty Pass Animations
10481,https://svs.gsfc.nasa.gov/10481/,Feeling the Sting of Climate Change
10482,https://svs.gsfc.nasa.gov/10482/,Honey Bees and Climate Change Animations
10483,https://svs.gsfc.nasa.gov/10483/,LRO Early Results Press Conference Visuals
10484,https://svs.gsfc.nasa.gov/10484/,Landsat: A Space Age Water Gauge
10485,https://svs.gsfc.nasa.gov/10485/,Swift's UV portrait of the Andromeda Galaxy
10486,https://svs.gsfc.nasa.gov/10486/,LOLA: Defining the Lunar Terrain
10487,https://svs.gsfc.nasa.gov/10487/,NASA's Spacebook
10488,https://svs.gsfc.nasa.gov/10488/,MAVEN
10489,https://svs.gsfc.nasa.gov/10489/,Gamma-ray Burst Photon Delay as Expected by Quantum Gravity
10490,https://svs.gsfc.nasa.gov/10490/,Science For a Hungry World: Introduction
10491,https://svs.gsfc.nasa.gov/10491/,Science For a Hungry World: NASA's Partners
10492,https://svs.gsfc.nasa.gov/10492/,Arctic Sea Ice Conceptual Animation
10493,https://svs.gsfc.nasa.gov/10493/,Arctic Sea Ice 101
10494,https://svs.gsfc.nasa.gov/10494/,The Carbon Cycle
10495,https://svs.gsfc.nasa.gov/10495/,Marine Food Web
10496,https://svs.gsfc.nasa.gov/10496/,Science for a Hungry World: Land Cover Land Use Change
10497,https://svs.gsfc.nasa.gov/10497/,The Ocean's Green Machines
10498,https://svs.gsfc.nasa.gov/10498/,Keeping Up With Carbon
10499,https://svs.gsfc.nasa.gov/10499/,Zoom from the Milky Way Galaxy to our Heliosphere
10500,https://svs.gsfc.nasa.gov/10500/,Science for a Hungry World: Food Security
10501,https://svs.gsfc.nasa.gov/10501/,The Water Cycle
10502,https://svs.gsfc.nasa.gov/10502/,Climate Change and the Global Ocean
10503,https://svs.gsfc.nasa.gov/10503/,"Melting Ice, Rising Seas"
10504,https://svs.gsfc.nasa.gov/10504/,Salt of the Earth
10505,https://svs.gsfc.nasa.gov/10505/,"Blazars at Galactic North Pole, Seen in Fermi's First Year of Observations"
10506,https://svs.gsfc.nasa.gov/10506/,Women in Astronomy 2009
10507,https://svs.gsfc.nasa.gov/10507/,Gamma-Rays from High-Mass X-Ray Binaries
10508,https://svs.gsfc.nasa.gov/10508/,Fermi All-Sky First Year Progress
10509,https://svs.gsfc.nasa.gov/10509/,"Water, Water Everywhere!"
10510,https://svs.gsfc.nasa.gov/10510/,Einstein's Cosmic Speed Limit
10512,https://svs.gsfc.nasa.gov/10512/,Science for a Hungry World: Growing Water Problems
10513,https://svs.gsfc.nasa.gov/10513/,A Landsat Flyby
10514,https://svs.gsfc.nasa.gov/10514/,Terra@10: Terra 10th Anniversary Video
10515,https://svs.gsfc.nasa.gov/10515/,NASA's BEST Students
10516,https://svs.gsfc.nasa.gov/10516/,Science for a Hungry World: Agriculture and Climate Change
10517,https://svs.gsfc.nasa.gov/10517/,Remote Sensing Conceptual Animation
10518,https://svs.gsfc.nasa.gov/10518/,ICESat Spacecraft
10519,https://svs.gsfc.nasa.gov/10519/,Landsat 7 Spacecraft Animations
10520,https://svs.gsfc.nasa.gov/10520/,New Millisecond Radio Pulsars Found in Fermi LAT Unidentified Sources
10521,https://svs.gsfc.nasa.gov/10521/,The Road to Glory
10522,https://svs.gsfc.nasa.gov/10522/,The Rough Road to Space
10523,https://svs.gsfc.nasa.gov/10523/,The Particle Puzzle
10524,https://svs.gsfc.nasa.gov/10524/,Glory's Suncatcher
10525,https://svs.gsfc.nasa.gov/10525/,Hello Crud
10526,https://svs.gsfc.nasa.gov/10526/,The Sun Song
10527,https://svs.gsfc.nasa.gov/10527/,TDRS-1 Retirement
10528,https://svs.gsfc.nasa.gov/10528/,LRO Early Results Press Conference
10529,https://svs.gsfc.nasa.gov/10529/,The Cosmic Background Explorer (COBE) - 1989
10530,https://svs.gsfc.nasa.gov/10530/,Taking Earth's Temperature
10531,https://svs.gsfc.nasa.gov/10531/,Fermi telescope detects gamma-rays from Cygnus X-3
10532,https://svs.gsfc.nasa.gov/10532/,Type Ia supernova
10533,https://svs.gsfc.nasa.gov/10533/,Suzaku (formerly Astro-E2) Spacecraft
10534,https://svs.gsfc.nasa.gov/10534/,IXO Spacecraft
10535,https://svs.gsfc.nasa.gov/10535/,SDO: Commissioning and Handover
10536,https://svs.gsfc.nasa.gov/10536/,Suzaku: Intergalactic Prospector
10537,https://svs.gsfc.nasa.gov/10537/,Climate in a Box
10538,https://svs.gsfc.nasa.gov/10538/,SDO Beauty Pass
10539,https://svs.gsfc.nasa.gov/10539/,SDO in Orbit
10540,https://svs.gsfc.nasa.gov/10540/,Brightest-ever Flare From Blazar 3C 454.3
10541,https://svs.gsfc.nasa.gov/10541/,Terra Spacecraft
10542,https://svs.gsfc.nasa.gov/10542/,SDO Spacecraft and Instruments
10543,https://svs.gsfc.nasa.gov/10543/,Neutron Star Merge
10544,https://svs.gsfc.nasa.gov/10544/,Black Hole Binary Creates Gravity Waves
10545,https://svs.gsfc.nasa.gov/10545/,Black Hole Accretion Disc Energies
10546,https://svs.gsfc.nasa.gov/10546/,Neutron Star and Red Giant Binary Destruction
10547,https://svs.gsfc.nasa.gov/10547/,Supernova with Expanding Shell
10549,https://svs.gsfc.nasa.gov/10549/,Swift Survey Finds 'Smoking Gun' of Black Hole Activation
10550,https://svs.gsfc.nasa.gov/10550/,Forest Recovering From Mount St. Helens Eruption
10551,https://svs.gsfc.nasa.gov/10551/,SDO First Light Press Conference
10552,https://svs.gsfc.nasa.gov/10552/,TIROS-1: The Forecast Revolution Begins (50th Anniversary)
10553,https://svs.gsfc.nasa.gov/10553/,Saved By A Weather Satellite
10554,https://svs.gsfc.nasa.gov/10554/,NASA Develops Enhanced Search and Rescue Technologies
10555,https://svs.gsfc.nasa.gov/10555/,Massive Merger of Galaxies is Most Powerful on Record
10557,https://svs.gsfc.nasa.gov/10557/,2009 Global Temperature Package: Year Tied as Second Hottest
10560,https://svs.gsfc.nasa.gov/10560/,Interview Segments with Key Glory Personnel
10561,https://svs.gsfc.nasa.gov/10561/,Central Engine Supernova
10562,https://svs.gsfc.nasa.gov/10562/,Gulf of Mexico Oil Spill
10563,https://svs.gsfc.nasa.gov/10563/,Supercomputing the Climate
10564,https://svs.gsfc.nasa.gov/10564/,Hubble IMAX: Educator Resources
10565,https://svs.gsfc.nasa.gov/10565/,James Webb Space Telescope Mission Movie Trailer
10566,https://svs.gsfc.nasa.gov/10566/,Fermi Explores Supernova Remnants
10567,https://svs.gsfc.nasa.gov/10567/,How Cosmic-ray Protons Make Gamma rays
10568,https://svs.gsfc.nasa.gov/10568/,NCCS Video Files
10569,https://svs.gsfc.nasa.gov/10569/,Webb Telescope Spacecraft Animations
10570,https://svs.gsfc.nasa.gov/10570/,"JWST Full Scale Model Construction in Battery Park, NY"
10572,https://svs.gsfc.nasa.gov/10572/,FOOTPRINTS
10573,https://svs.gsfc.nasa.gov/10573/,RETURN TO THE MOON
10574,https://svs.gsfc.nasa.gov/10574/,Piecing Together the Temperature Puzzle
10575,https://svs.gsfc.nasa.gov/10575/,GOES-P: Mission Overview Video
10576,https://svs.gsfc.nasa.gov/10576/,"From the Sun, to You."
10577,https://svs.gsfc.nasa.gov/10577/,Marco Midon - Black History Month
10579,https://svs.gsfc.nasa.gov/10579/,A Warming World Promo
10580,https://svs.gsfc.nasa.gov/10580/,Dark Flow
10581,https://svs.gsfc.nasa.gov/10581/,GOES-P Readied For Launch
10582,https://svs.gsfc.nasa.gov/10582/,Pulsar Blinking
10583,https://svs.gsfc.nasa.gov/10583/,Slices Through the Solar Interior
10584,https://svs.gsfc.nasa.gov/10584/,Heliophysics Program Overview
10585,https://svs.gsfc.nasa.gov/10585/,Goddard Symposium 2010
10586,https://svs.gsfc.nasa.gov/10586/,GOES Weather with Topper Shutt
10587,https://svs.gsfc.nasa.gov/10587/,The Cosmic Ray Telescope for the Effects of Radiation
10588,https://svs.gsfc.nasa.gov/10588/,Laser Radar Animation
10589,https://svs.gsfc.nasa.gov/10589/,"Operation IceBridge: Greenland, Spring 2010 Pre-mission Video"
10590,https://svs.gsfc.nasa.gov/10590/,Swift's 500 Gamma-ray Bursts
10591,https://svs.gsfc.nasa.gov/10591/,Map of Greenland
10592,https://svs.gsfc.nasa.gov/10592/,DC-8 Floor plan animation
10593,https://svs.gsfc.nasa.gov/10593/,Arctic 2010 Video File  - 3/18/10
10594,https://svs.gsfc.nasa.gov/10594/,Making the Impossible Possible
10595,https://svs.gsfc.nasa.gov/10595/,Ten Cool Things Seen in the First Year of LRO
10596,https://svs.gsfc.nasa.gov/10596/,"IceBridge 2010, a liveshot with Lora Koenig"
10597,https://svs.gsfc.nasa.gov/10597/,Operation IceBridge's 2010 Arctic Campaign Takes Off: Reporters Package
10598,https://svs.gsfc.nasa.gov/10598/,GloPac Science Flights — short video and video file
10599,https://svs.gsfc.nasa.gov/10599/,Lunar Polar Craters May Be Electrified
