ID,URL,Title
2996,https://svs.gsfc.nasa.gov/2996/,Hurricane Isabel: Under the Hood (with popout boxes)
2997,https://svs.gsfc.nasa.gov/2997/,Hurricane Isabel: Under the Hood (PR and AMSU only)
2998,https://svs.gsfc.nasa.gov/2998/,MODIS Data May Aid EPA Air Quality Predictions (Wide)
2999,https://svs.gsfc.nasa.gov/2999/,MODIS Data May Aid EPA Air Quality Predictions (Tight)
3000,https://svs.gsfc.nasa.gov/3000/,Hurricane Isabel Model: Clouds
3001,https://svs.gsfc.nasa.gov/3001/,Hurricane Isabel Model: Precipitable Water
3002,https://svs.gsfc.nasa.gov/3002/,Hurricane Isabel Model: Clouds and Precipitable Water
3003,https://svs.gsfc.nasa.gov/3003/,Hurricane Ivan Heads Towards Jamaica
3004,https://svs.gsfc.nasa.gov/3004/,Hurricane Ivan Closes in on Jamaica
3005,https://svs.gsfc.nasa.gov/3005/,Hurricane Ivan Progression
3006,https://svs.gsfc.nasa.gov/3006/,Hurricane Ivan Progression with Fixed View
3007,https://svs.gsfc.nasa.gov/3007/,"Hurricane Ivan Progression as Seen by MODIS September 9-14, 2004"
3008,https://svs.gsfc.nasa.gov/3008/,"Hurricane Ivan Rainfall Structure on September 13, 2004"
3009,https://svs.gsfc.nasa.gov/3009/,"TRMM Looks at the Rain Fueling Hurricane Ivan on September 15, 2004"
3010,https://svs.gsfc.nasa.gov/3010/,"Hurricane Ivan Rainfall Structure Seen from TRMM September 9, 2004"
3011,https://svs.gsfc.nasa.gov/3011/,"Hurricane Ivan Rainfall Structure seen by TRMM on September 16, 2004"
3012,https://svs.gsfc.nasa.gov/3012/,"Hurricane Ivan Track and Intensity September 2-19, 2004"
3013,https://svs.gsfc.nasa.gov/3013/,"Hurricane Ivan Rain Accumulation September 2-19, 2004 (wide view)"
3014,https://svs.gsfc.nasa.gov/3014/,"Hurricane Ivan Rain Accumulation September 2-19, 2004 (Close View)"
3015,https://svs.gsfc.nasa.gov/3015/,A Fixed View of Hurricane Ivan
3016,https://svs.gsfc.nasa.gov/3016/,"TRMM Precipiation Radar Observes Rain Structure of Hurricane Jeanne on September 23, 2004"
3017,https://svs.gsfc.nasa.gov/3017/,"Hurricane Jeanne on September 23, 2004"
3018,https://svs.gsfc.nasa.gov/3018/,A Fixed View of Hurricane Jeanne's Progression
3019,https://svs.gsfc.nasa.gov/3019/,Hurricane Jeanne's Progression with a Fixed View
3020,https://svs.gsfc.nasa.gov/3020/,Up Close and Personal with Hurricane Jeanne
3021,https://svs.gsfc.nasa.gov/3021/,Hurricane Jeanne Crashes into Florida
3022,https://svs.gsfc.nasa.gov/3022/,"Hurricanes Frances, Ivan, and Jeanne Bring Record Rainfall"
3023,https://svs.gsfc.nasa.gov/3023/,"TRMM Tropical Microwave Imager (TMI) Sees the Power of Hurricane Jeanne on September 25, 2004"
3024,https://svs.gsfc.nasa.gov/3024/,"TRMM Tropical Microwave Imager (TMI) Sees the Power of Hurricane Jeanne on September 26, 2004"
3025,https://svs.gsfc.nasa.gov/3025/,"TRMM Tropical Microwave Imager (TMI) view of Hurricane Jeanne on September 27, 2004"
3026,https://svs.gsfc.nasa.gov/3026/,"Hurricane Ivan Track and Intensity September 2-23, 2004"
3027,https://svs.gsfc.nasa.gov/3027/,Snow Cover over North America during the Winter of 2001-2002 (WMS)
3028,https://svs.gsfc.nasa.gov/3028/,A 3-Dimensional Model of the Magnetosphere (WMS)
3029,https://svs.gsfc.nasa.gov/3029/,"Zoom into Austin, Texas, using Landsat Imagery (WMS)"
3030,https://svs.gsfc.nasa.gov/3030/,"Zoom into Boulder, Colorado, using Landsat Imagery (WMS)"
3031,https://svs.gsfc.nasa.gov/3031/,"Zoom into NASA's Goddard Space Flight Center, using Landsat Imagery (WMS)"
3032,https://svs.gsfc.nasa.gov/3032/,"Model of Clouds during Hurricane Isabel, 2003 (WMS)"
3033,https://svs.gsfc.nasa.gov/3033/,"Model of Precipitable Water during Hurricane Isabel, 2003 (WMS)"
3034,https://svs.gsfc.nasa.gov/3034/,"Accumulated Rainfall during Hurricanes Frances, Ivan, and Jeanne, 2004 (WMS)"
3035,https://svs.gsfc.nasa.gov/3035/,"Progression of Hurricane Jeanne, 2004 (WMS)"
3036,https://svs.gsfc.nasa.gov/3036/,Daily Sea Ice Surface Temperature 2002-2003 (WMS)
3037,https://svs.gsfc.nasa.gov/3037/,Sea Ice Surface Temperature with Regions of No Data Indicated (WMS)
3038,https://svs.gsfc.nasa.gov/3038/,The 2004 Antarctic Ozone Hole
3039,https://svs.gsfc.nasa.gov/3039/,ICESat Cloud Walls (scripted camera path)
3040,https://svs.gsfc.nasa.gov/3040/,ICESat Cloud Walls (south to north spiral camera path)
3041,https://svs.gsfc.nasa.gov/3041/,Lunar Fly By and Earth Approach
3042,https://svs.gsfc.nasa.gov/3042/,Lunar Beauty Shot
3043,https://svs.gsfc.nasa.gov/3043/,Indecisive El Niño Exhibits 'Split Personality'
3044,https://svs.gsfc.nasa.gov/3044/,Apollo Lunar Landing Sites
3045,https://svs.gsfc.nasa.gov/3045/,fvGCM Climate Model and Hurricane Ivan Track
3046,https://svs.gsfc.nasa.gov/3046/,fvGCM Climate Model and Hurricane Ivan Global View
3047,https://svs.gsfc.nasa.gov/3047/,22-Year Arctic Surface Temperature Trend
3048,https://svs.gsfc.nasa.gov/3048/,Earth's Radiation Belts Tremble Under Impact of Solar Storm
3049,https://svs.gsfc.nasa.gov/3049/,Radiation Belts and Plasmapause Fluctuate Under Solar Storm
3050,https://svs.gsfc.nasa.gov/3050/,Tour of the Plasmasphere and Plasmapause
3051,https://svs.gsfc.nasa.gov/3051/,Plasmapause Convects to the Magnetopause During Halloween Solar Storm
3052,https://svs.gsfc.nasa.gov/3052/,Earth's Radiation Belts with Safe Zone Orbit
3053,https://svs.gsfc.nasa.gov/3053/,Jakobshavn Glacier Calving Front Recession (2001-2003)
3054,https://svs.gsfc.nasa.gov/3054/,Jakobshavn Glacial Floe
3055,https://svs.gsfc.nasa.gov/3055/,History of Jakobshavn Glacier Recession
3056,https://svs.gsfc.nasa.gov/3056/,New Data from Aura's Microwave Limb Sounder (MLS) Chlorine Monoxide
3057,https://svs.gsfc.nasa.gov/3057/,New Data from Aura's Microwave Limb Sounder (MLS) Water Vapor
3058,https://svs.gsfc.nasa.gov/3058/,New Data from Aura's Microwave Limb Sounder (MLS) Hydrochloric Acid
3059,https://svs.gsfc.nasa.gov/3059/,New Data from Aura's Microwave Limb Sounder (MLS) Nitric Acid
3060,https://svs.gsfc.nasa.gov/3060/,New Data from Aura's Microwave Limb Sounder (MLS) Ozone
3061,https://svs.gsfc.nasa.gov/3061/,New Data from Aura's Microwave Limb Sounder (MLS) Temperature
3062,https://svs.gsfc.nasa.gov/3062/,The Microwave Limb Sounder Observes the Lower Stratosphere and Upper Troposphere
3063,https://svs.gsfc.nasa.gov/3063/,fvGCM Climate Model of Hurricane Ivan (hourly/closeup view)
3064,https://svs.gsfc.nasa.gov/3064/,fvGCM Climate Model of Hurricane Frances and other storms
3065,https://svs.gsfc.nasa.gov/3065/,Sea Ice Minimum Extent for 1979-2004
3066,https://svs.gsfc.nasa.gov/3066/,"Aura/OMI Ozone Hole from September 12, 2004 to November 15,2004"
3067,https://svs.gsfc.nasa.gov/3067/,"Aura/OMI Ozone Hole from September 12, 2004 to November 15, 2004 with Polar Vortex Demarcation"
3068,https://svs.gsfc.nasa.gov/3068/,AURA/OMI Tropospheric Ozone over South America
3069,https://svs.gsfc.nasa.gov/3069/,AURA/OMI Tropospheric Ozone over South America and Africa
3070,https://svs.gsfc.nasa.gov/3070/,AURA/OMI Tropospheric Ozone over Indonesia
3071,https://svs.gsfc.nasa.gov/3071/,AURA/OMI Tropospheric Ozone On a Flat Map
3072,https://svs.gsfc.nasa.gov/3072/,"Jakobshavn Glacier, Greenland flow field"
3073,https://svs.gsfc.nasa.gov/3073/,"NO2 Concentration Over the United States: September 24 - November 7, 2004"
3074,https://svs.gsfc.nasa.gov/3074/,"Nitrogen Dioxide Concentration Over China: September 24 - November 7, 2004"
3075,https://svs.gsfc.nasa.gov/3075/,Biomass Burning over South America
3076,https://svs.gsfc.nasa.gov/3076/,Jakobshavn Glacier Calving Front Recession Updated (2001-2004)
3077,https://svs.gsfc.nasa.gov/3077/,Updated History of Jakobshavn Glacier Recession (1850-2004)
3078,https://svs.gsfc.nasa.gov/3078/,Iceberg Slows Shipping Lanes to McMurdo Station
3079,https://svs.gsfc.nasa.gov/3079/,Long Island Size Iceberg Slows Shipping Lanes
3080,https://svs.gsfc.nasa.gov/3080/,Long Island Size Iceberg Blocks Penguins Feeding Grounds
3081,https://svs.gsfc.nasa.gov/3081/,Giant Iceberg in McMurdo Sound (WMS)
3082,https://svs.gsfc.nasa.gov/3082/,Ozone from new Microwave Limb Sounder on Aura (WMS)
3083,https://svs.gsfc.nasa.gov/3083/,NASA Satellite Reveals Heavy Rainfall Patterns in California
3084,https://svs.gsfc.nasa.gov/3084/,Snap! Crackle! POP! Goes the Iceberg!
3085,https://svs.gsfc.nasa.gov/3085/,Sea Ice Held Captive Gets Break
3086,https://svs.gsfc.nasa.gov/3086/,Antarctic Iceberg Breaks Up Ice Sheet
3087,https://svs.gsfc.nasa.gov/3087/,Long Island Size Iceberg Collides with Ice Sheet
3088,https://svs.gsfc.nasa.gov/3088/,Chlorine Monoxide from new Microwave Limb Sounder on Aura (WMS)
3089,https://svs.gsfc.nasa.gov/3089/,Average Clear-sky Albedo (WMS)
3090,https://svs.gsfc.nasa.gov/3090/,Average Total-sky Albedo (WMS)
3091,https://svs.gsfc.nasa.gov/3091/,Average Clear-sky Outgoing Longwave Flux (WMS)
3092,https://svs.gsfc.nasa.gov/3092/,Average Total-sky Outgoing Longwave Flux (WMS)
3093,https://svs.gsfc.nasa.gov/3093/,Average Clear-sky Net Radiant Flux (WMS)
3094,https://svs.gsfc.nasa.gov/3094/,Average Total-sky Net Radiant Flux (WMS)
3095,https://svs.gsfc.nasa.gov/3095/,Average Total-sky Incoming Solar Flux (WMS)
3096,https://svs.gsfc.nasa.gov/3096/,Average Clear-sky Outgoing Shortwave Flux (WMS)
3097,https://svs.gsfc.nasa.gov/3097/,Average Total-sky Outgoing Shortwave Flux (WMS)
3098,https://svs.gsfc.nasa.gov/3098/,Polar Vortex (WMS)
3099,https://svs.gsfc.nasa.gov/3099/,Hydrogen Chloride from new Microwave Limb Sounder on Aura (WMS)
3100,https://svs.gsfc.nasa.gov/3100/,Nitric acid from new Microwave Limb Sounder on Aura (WMS)
3101,https://svs.gsfc.nasa.gov/3101/,Water vapor from new Microwave Limb Sounder on Aura (WMS)
3102,https://svs.gsfc.nasa.gov/3102/,Temperature from new Microwave Limb Sounder on Aura (WMS)
3103,https://svs.gsfc.nasa.gov/3103/,NASA Balloon Makes Record-Breaking Flight
3104,https://svs.gsfc.nasa.gov/3104/,Instantaneous Scene Identification (WMS)
3105,https://svs.gsfc.nasa.gov/3105/,Instantaneous Incoming Solar Flux (WMS)
3106,https://svs.gsfc.nasa.gov/3106/,Instantaneous Net Radiation Flux (WMS)
3107,https://svs.gsfc.nasa.gov/3107/,Instantaneous Outgoing Longwave Flux (WMS)
3108,https://svs.gsfc.nasa.gov/3108/,Instantaneous Outgoing Shortwave Flux (WMS)
3109,https://svs.gsfc.nasa.gov/3109/,Solar Irradiance (WMS)
3110,https://svs.gsfc.nasa.gov/3110/,Vegetation Images Show Drought in Western US (WMS)
3111,https://svs.gsfc.nasa.gov/3111/,Connections: Terrestrial Gamma Flashes and Lightning?
3112,https://svs.gsfc.nasa.gov/3112/,Aral Sea Evaporation (WMS)
3113,https://svs.gsfc.nasa.gov/3113/,Rondonia Deforestation (WMS)
3114,https://svs.gsfc.nasa.gov/3114/,Daily Erythemal Index (UV exposure) Measurements for 2000-2001 (WMS)
3115,https://svs.gsfc.nasa.gov/3115/,Gaps in the Earth's Radiation Belts
3116,https://svs.gsfc.nasa.gov/3116/,"Mount St. Helens Before, During, and After (WMS)"
3117,https://svs.gsfc.nasa.gov/3117/,"Great Zoom into Kodak Theater with spin (Los Angeles, CA)"
3118,https://svs.gsfc.nasa.gov/3118/,"Great Zoom out from Kodak Theater with spin (Los Angeles, CA)"
3119,https://svs.gsfc.nasa.gov/3119/,ICESat Aerosols and Clouds over Africa
3120,https://svs.gsfc.nasa.gov/3120/,ICESat Aerosols over Africa
3121,https://svs.gsfc.nasa.gov/3121/,ICESat Aerosols and Clouds over India
3122,https://svs.gsfc.nasa.gov/3122/,ICESat Aerosols over India
3123,https://svs.gsfc.nasa.gov/3123/,Larsen Ice Shelf Collapse (WMS)
3124,https://svs.gsfc.nasa.gov/3124/,Monthly Average Erythemal Index (UV exposure) for 2000-2001 (WMS)
3126,https://svs.gsfc.nasa.gov/3126/,Daily Erythemal Index (UV exposure) for 2000-2001 (WMS)
3127,https://svs.gsfc.nasa.gov/3127/,Pine Island Glacier Calving (WMS)
3128,https://svs.gsfc.nasa.gov/3128/,Aqua/AIRS Water Vapor near Southern California
3129,https://svs.gsfc.nasa.gov/3129/,Aqua/AIRS Water Vapor near Southern California #2
3130,https://svs.gsfc.nasa.gov/3130/,Continental Effects of 2004 Alaskan Fires (WMS)
3131,https://svs.gsfc.nasa.gov/3131/,Hurricane Isabel 2003 Rain Accumulation
3132,https://svs.gsfc.nasa.gov/3132/,Aerosols from 2003 Southern California Fires (WMS)
3133,https://svs.gsfc.nasa.gov/3133/,Transatlantic Dust from North Africa (WMS)
3134,https://svs.gsfc.nasa.gov/3134/,"Hurricane Frances Structure September 1, 2004"
3135,https://svs.gsfc.nasa.gov/3135/,Sea Surface Temperature Anomalies during El Niño/La Niña Event of 1997-1998 (WMS)
3136,https://svs.gsfc.nasa.gov/3136/,Antarctic Ozone Sequence 1996 through 2004
3137,https://svs.gsfc.nasa.gov/3137/,"Antarctic Ozone Sequence 1996 through 2004, Data Dropouts Removed"
3138,https://svs.gsfc.nasa.gov/3138/,QuikSCAT Antarctic Sea Ice (WMS)
3139,https://svs.gsfc.nasa.gov/3139/,Hurricane Isabel 2003 Progression Images
3140,https://svs.gsfc.nasa.gov/3140/,Jakobshavn Glacier Retreat (WMS)
3141,https://svs.gsfc.nasa.gov/3141/,Jakobshavn Glacier Ice Flow (WMS)
3142,https://svs.gsfc.nasa.gov/3142/,Sea Surface Height Anomalies during El Niño/La Niña Event of 1997-1998 (WMS)
3143,https://svs.gsfc.nasa.gov/3143/,Global Lightning Accumulation (WMS)
3144,https://svs.gsfc.nasa.gov/3144/,Global Lightning Flash Rate Density (WMS)
3145,https://svs.gsfc.nasa.gov/3145/,Hurricane Frances Rain Towers
3146,https://svs.gsfc.nasa.gov/3146/,Rainfall Accumulation from Hurricane Isabel (WMS)
3147,https://svs.gsfc.nasa.gov/3147/,"Progression of Hurricane Frances, 2004 (WMS)"
3148,https://svs.gsfc.nasa.gov/3148/,Heavy Rainfall Leads to Southern California Mudslides (WMS)
3149,https://svs.gsfc.nasa.gov/3149/,Gamma Ray Bursts May Have Caused Ancient Extinctions
3151,https://svs.gsfc.nasa.gov/3151/,"Progression of Hurricane Ivan, 2004 (WMS)"
3152,https://svs.gsfc.nasa.gov/3152/,Urban Signatures: Temperature (WMS)
3153,https://svs.gsfc.nasa.gov/3153/,"Progression of Hurricane Charley, 2004 (WMS)"
3154,https://svs.gsfc.nasa.gov/3154/,Urban Signatures: Evaporation (WMS)
3155,https://svs.gsfc.nasa.gov/3155/,Urban Signatures: Thermal Radiation (WMS)
3156,https://svs.gsfc.nasa.gov/3156/,Urban Signatures: Latent Heat Flux (WMS)
3157,https://svs.gsfc.nasa.gov/3157/,Urban Signatures: Sensible Heat Flux (WMS)
3158,https://svs.gsfc.nasa.gov/3158/,"Progression of Hurricane Fabian, 2003 (WMS)"
3159,https://svs.gsfc.nasa.gov/3159/,SOHO/LASCO View of January 2005 Solar Events
3160,https://svs.gsfc.nasa.gov/3160/,January 2005 Solar Flares from SOHO/EIT
3161,https://svs.gsfc.nasa.gov/3161/,"TRACE Ultraviolet View of January 20, 2005 Solar Flare"
3162,https://svs.gsfc.nasa.gov/3162/,"RHESSI and TRACE View of January 20, 2005 Solar Flare"
3163,https://svs.gsfc.nasa.gov/3163/,"United States Mean Population Center, 1790-2000 (WMS)"
3164,https://svs.gsfc.nasa.gov/3164/,"United States Median Center of Population, 1880-2000 (WMS)"
3165,https://svs.gsfc.nasa.gov/3165/,X-ray Images of the North Polar Region from the Chandra HRC-I Instrument
3166,https://svs.gsfc.nasa.gov/3166/,"Monthly Sea Ice Climatology, 1979-2002 (WMS)"
3167,https://svs.gsfc.nasa.gov/3167/,"September Minimum Sea Ice Concentration, 1979-2004 (WMS)"
3168,https://svs.gsfc.nasa.gov/3168/,"Daily 89 MHz Brightness Temperature, 2002-2003 (WMS)"
3169,https://svs.gsfc.nasa.gov/3169/,"Sulfur Dioxide from the Mount Pinatubo Volcanic Eruption, 1991 (WMS)"
3170,https://svs.gsfc.nasa.gov/3170/,X-Ray Images of the North Polar Region (WMS)
3171,https://svs.gsfc.nasa.gov/3171/,Wind Anomalies During El Niño/La Niña Event of 1997-1998 (WMS)
3172,https://svs.gsfc.nasa.gov/3172/,"Hurricane Ivan Rainfall Structure with Cloud Overlay on September 16, 2004"
3175,https://svs.gsfc.nasa.gov/3175/,Outgoing Shortwave Flux Compared to Clouds (WMS)
3176,https://svs.gsfc.nasa.gov/3176/,Outgoing Longwave Flux Compared to Clouds (WMS)
3177,https://svs.gsfc.nasa.gov/3177/,Net Radiation Flux Compared to Clouds (WMS)
3178,https://svs.gsfc.nasa.gov/3178/,Incoming Solar Flux Compared to Clouds (WMS)
3179,https://svs.gsfc.nasa.gov/3179/,Scene Identification Compared to Clouds (WMS)
3180,https://svs.gsfc.nasa.gov/3180/,MODIS Daily Global Snow Cover and Sea Ice Surface Temperature as seen in the SIGGRAPH 2005 Electronic Theater
3181,https://svs.gsfc.nasa.gov/3181/,A Tour of the Cryosphere
3182,https://svs.gsfc.nasa.gov/3182/,Global Atmospheric Sea Level Pressure during Hurricane Frances (WMS)
3183,https://svs.gsfc.nasa.gov/3183/,Great Zoom into the Houston Museum of Natural Science
3184,https://svs.gsfc.nasa.gov/3184/,fvGCM and Hurricane Jeanne Track
3185,https://svs.gsfc.nasa.gov/3185/,"Monthly Snow Climatology, 1979-2002 (WMS)"
3186,https://svs.gsfc.nasa.gov/3186/,Minimum Sea Ice Extent (WMS)
3188,https://svs.gsfc.nasa.gov/3188/,Antarctic Heating and Cooling Trends
3190,https://svs.gsfc.nasa.gov/3190/,"Hurricane Dennis on July 6, 2005"
3191,https://svs.gsfc.nasa.gov/3191/,"Sea Surface Temperature, 2005 (WMS)"
3192,https://svs.gsfc.nasa.gov/3192/,"Sea Surface Temperature Anomaly, 2005 (WMS)"
3193,https://svs.gsfc.nasa.gov/3193/,"Sea Surface Height Anomaly, 2003-2005 (WMS)"
3194,https://svs.gsfc.nasa.gov/3194/,"Progression of Hurricane Dennis, 2005 (WMS)"
3195,https://svs.gsfc.nasa.gov/3195/,"The Cave Creek Complex Fire near Phoenix, Arizona"
3196,https://svs.gsfc.nasa.gov/3196/,Hurricane Dennis
3197,https://svs.gsfc.nasa.gov/3197/,Global Atmospheric Surface Pressure during Hurricane Frances (WMS)
3198,https://svs.gsfc.nasa.gov/3198/,Global Surface Air Temperature during Hurricane Frances (WMS)
3199,https://svs.gsfc.nasa.gov/3199/,Global Surface Latent Heat Flux during Hurricane Frances (WMS)
3200,https://svs.gsfc.nasa.gov/3200/,"Progression of Hurricane Emily, 2005 (WMS)"
3201,https://svs.gsfc.nasa.gov/3201/,Global Surface Wind Speed during Hurricane Frances (WMS)
3202,https://svs.gsfc.nasa.gov/3202/,Global Atmospheric Water Vapor during Hurricane Frances (WMS)
3203,https://svs.gsfc.nasa.gov/3203/,Global High Altitude Wind Speed during Hurricane Frances (WMS)
3204,https://svs.gsfc.nasa.gov/3204/,ARGO Float Animation #1
3205,https://svs.gsfc.nasa.gov/3205/,ARGO Float Animation #2
3206,https://svs.gsfc.nasa.gov/3206/,TOPEX/JASON Sea Level
3207,https://svs.gsfc.nasa.gov/3207/,Global 300 hPa Geopotential Height during Hurricane Frances (WMS)
3208,https://svs.gsfc.nasa.gov/3208/,Global Cloud Cover during Hurricane Frances (WMS)
3209,https://svs.gsfc.nasa.gov/3209/,Global Convective Precipitation during Hurricane Frances (WMS)
3210,https://svs.gsfc.nasa.gov/3210/,Global Large-scale Precipitation during Hurricane Frances (WMS)
3211,https://svs.gsfc.nasa.gov/3211/,Space Weather Forecasting: Quiet Times Ahead
3212,https://svs.gsfc.nasa.gov/3212/,Space Weather Forecasting: Active Times Ahead
3214,https://svs.gsfc.nasa.gov/3214/,"Hurricane Katrina from TRMM: August 25, 2005"
3215,https://svs.gsfc.nasa.gov/3215/,"Hurricane Emily: July 20, 2005"
3216,https://svs.gsfc.nasa.gov/3216/,GOES-12 Imagery of Hurricane Katrina: Longwave Infrared Close-up (WMS)
3218,https://svs.gsfc.nasa.gov/3218/,"Hurricane Katrina from TRMM: August 28, 2005"
3219,https://svs.gsfc.nasa.gov/3219/,"Hurricane Katrina from TRMM: August 29, 2005"
3220,https://svs.gsfc.nasa.gov/3220/,"Behold, A Whirlwind Came: The Science of Tracking Hurricanes"
3221,https://svs.gsfc.nasa.gov/3221/,Hurricane Katrina Rain Accumulation
3222,https://svs.gsfc.nasa.gov/3222/,Hurricane Katrina Sea Surface Temperature
3224,https://svs.gsfc.nasa.gov/3224/,Hurricane Katrina Progression
3225,https://svs.gsfc.nasa.gov/3225/,"Sea Surface Temperature from June 1, 2005 to August 29, 2005"
3226,https://svs.gsfc.nasa.gov/3226/,"Sea Surface Temperature, Clouds, and Tropical Depression/Storm/Hurricane Tracks from June 1, 2005 to August 29, 2005"
3227,https://svs.gsfc.nasa.gov/3227/,NASA's Orbiting Earth Observing Fleet (Improved Background)
3228,https://svs.gsfc.nasa.gov/3228/,Hurricanes
3229,https://svs.gsfc.nasa.gov/3229/,Global SST Model (ECCO)
3230,https://svs.gsfc.nasa.gov/3230/,GOES-12 Imagery of Hurricane Katrina: Full Disk Visible (WMS)
3231,https://svs.gsfc.nasa.gov/3231/,GOES-12 Imagery of Hurricane Katrina: Full Disk Shortwave Infrared (WMS)
3232,https://svs.gsfc.nasa.gov/3232/,GOES-12 Imagery of Hurricane Katrina: Full Disk Water Vapor (WMS)
3233,https://svs.gsfc.nasa.gov/3233/,GOES-12 Imagery of Hurricane Katrina: Full Disk Longwave Infrared (WMS)
3234,https://svs.gsfc.nasa.gov/3234/,GOES-12 Imagery of Hurricane Katrina: Full Disk Lower Level Temperature (WMS)
3235,https://svs.gsfc.nasa.gov/3235/,GOES-10 Imagery of Hurricane Katrina: Full Disk Longwave Infrared (WMS)
3236,https://svs.gsfc.nasa.gov/3236/,GOES-12 Imagery of Hurricane Katrina: Longwave Infrared Overview (WMS)
3237,https://svs.gsfc.nasa.gov/3237/,GOES-12 Imagery of Hurricane Katrina: Longwave Infrared Progression (WMS)
3238,https://svs.gsfc.nasa.gov/3238/,"Progression of Hurricane Katrina, 2005 (WMS)"
3239,https://svs.gsfc.nasa.gov/3239/,Hurricane Katrina Rain Accumulation (WMS)
3240,https://svs.gsfc.nasa.gov/3240/,Hurricane Katrina Sea Surface Temperature (WMS)
3241,https://svs.gsfc.nasa.gov/3241/,2004 September Minimum Sea Ice Concentration
3242,https://svs.gsfc.nasa.gov/3242/,TRMM Microwave Brightness Temperature Swath during Hurricane Katrina: Vertical Polarization
3243,https://svs.gsfc.nasa.gov/3243/,TRMM Microwave Brightness Temperature Swath during Hurricane Katrina: Horizontal Polarization
3244,https://svs.gsfc.nasa.gov/3244/,"Hurricane Ophelia from TRMM: September 11, 2005 1648 Zulu"
3245,https://svs.gsfc.nasa.gov/3245/,"Hurricane Ophelia from TRMM: September 11, 2005 1826 Zulu"
3246,https://svs.gsfc.nasa.gov/3246/,Hurricane Ophelia
3247,https://svs.gsfc.nasa.gov/3247/,TRMM Microwave Brightness Temperature Progression during Hurricane Katrina: Vertical Polarization
3248,https://svs.gsfc.nasa.gov/3248/,TRMM Microwave Brightness Temperature Progression During Hurricane Katrina: Horizontal Polarization
3249,https://svs.gsfc.nasa.gov/3249/,TRMM Microwave Measurements during Hurricane Katrina: Vertical Polarization
3250,https://svs.gsfc.nasa.gov/3250/,TRMM Microwave Measurements during Hurricane Katrina: Horizontal Polarization
3251,https://svs.gsfc.nasa.gov/3251/,Hurricane Katrina GOES Clouds
3252,https://svs.gsfc.nasa.gov/3252/,Anatomy of Hurricane Isabel
3253,https://svs.gsfc.nasa.gov/3253/,Hurricane Katrina Hot Towers
3254,https://svs.gsfc.nasa.gov/3254/,GOES-12 Imagery of Hurricane Katrina: Visible Close-up (WMS)
3255,https://svs.gsfc.nasa.gov/3255/,Aqua MODIS Imagery of Hurricane Katrina (WMS)
3256,https://svs.gsfc.nasa.gov/3256/,The 2005 Antarctic Ozone Hole
3257,https://svs.gsfc.nasa.gov/3257/,"Sea Surface Temperature from June 1, 2005 to September 18, 2005"
3258,https://svs.gsfc.nasa.gov/3258/,"Hurricane Rita from TRMM: September 20, 2005"
3259,https://svs.gsfc.nasa.gov/3259/,Hurricane Rita's Hot Towers
3260,https://svs.gsfc.nasa.gov/3260/,"Hurricane Rita from TRMM: September 21, 2005"
3261,https://svs.gsfc.nasa.gov/3261/,Hurricane Rita Sea Surface Temperature and Clouds
3262,https://svs.gsfc.nasa.gov/3262/,"Hurricane Rita from TRMM: September 22, 2005"
3263,https://svs.gsfc.nasa.gov/3263/,"Hurricane Rita from TRMM: September 23, 2005"
3264,https://svs.gsfc.nasa.gov/3264/,Smithsonian Exhibit:  Antarctic Ozone Sequence 1979 through 2004
3265,https://svs.gsfc.nasa.gov/3265/,Hurricane Rita MODIS Progression
3266,https://svs.gsfc.nasa.gov/3266/,Sea Ice Minimum Concentration for 1979-2005
3267,https://svs.gsfc.nasa.gov/3267/,Sea Ice Minimum Concentration 3-year moving averages for 1979-1981 to 2003-2005
3268,https://svs.gsfc.nasa.gov/3268/,Hurricane Rita Rain Accumulation
3269,https://svs.gsfc.nasa.gov/3269/,Seasonal Landcover Change over Western Asia in 2004
3270,https://svs.gsfc.nasa.gov/3270/,Seasonal Landcover Change over the Alps
3271,https://svs.gsfc.nasa.gov/3271/,Seasonal Landcover Change over the Eastern United States
3272,https://svs.gsfc.nasa.gov/3272/,Global Seasonal Landcover in 2004
3273,https://svs.gsfc.nasa.gov/3273/,2004 Global Vegetation from Blue Marble Next Generation
3274,https://svs.gsfc.nasa.gov/3274/,Hubble Space Telescope Looks at the Moon to Prospect for Resources (Apollo 17 Landing Region)
3275,https://svs.gsfc.nasa.gov/3275/,Hubble Space Telescope Looks at the Moon to Prospect for Resources (Aristarchus Crater - gray)
3276,https://svs.gsfc.nasa.gov/3276/,Hubble Space Telescope Looks at the Moon to Prospect for Resources (Aristarchus Crater - color)
3277,https://svs.gsfc.nasa.gov/3277/,Seasonal Landcover Change over the Nile Delta in 2004
3278,https://svs.gsfc.nasa.gov/3278/,Seasonal Landcover Change over Eastern Asia in 2004
3279,https://svs.gsfc.nasa.gov/3279/,Named Storms from the 2005 Atlantic Hurricane Season  (Wide Shot)
3280,https://svs.gsfc.nasa.gov/3280/,"Hurricane Wilma from TRMM: October 17, 2005"
3281,https://svs.gsfc.nasa.gov/3281/,Hurricane Wilma's Hot Towers seen by TRMM 10/17/2005 at 1754Z
3282,https://svs.gsfc.nasa.gov/3282/,Hurricane Wilma — SSTs and Clouds
3283,https://svs.gsfc.nasa.gov/3283/,"TRMM Observes Hurricane Wilma on October 19, 2005"
3284,https://svs.gsfc.nasa.gov/3284/,"NASA's TRMM Satellite Captures Hurricane Wilma Data on October 20, 2005"
3285,https://svs.gsfc.nasa.gov/3285/,Hurricane Wilma MODIS Close-Up
3286,https://svs.gsfc.nasa.gov/3286/,Flight through the Coronal Loops
3287,https://svs.gsfc.nasa.gov/3287/,Rotating Tour of Solar Coronal Loops
3288,https://svs.gsfc.nasa.gov/3288/,"Hurricane Wilma on October 20, 2005"
3289,https://svs.gsfc.nasa.gov/3289/,TRMM captures Hot Towers Igniting Hurricane Wilma's Heat Engine
3290,https://svs.gsfc.nasa.gov/3290/,Hurricane Wilma Rain Accumulation
3291,https://svs.gsfc.nasa.gov/3291/,National Map Showing Habitat Suitability for Tamarisk Invasion
3292,https://svs.gsfc.nasa.gov/3292/,Habitat Suitability for Tamarisk Invasion in the State of Texas
3293,https://svs.gsfc.nasa.gov/3293/,The Habitat Suitability for Tamarisk Invasion in the State of New Mexico
3294,https://svs.gsfc.nasa.gov/3294/,MODIS Mosaic of Antarctica view of Pine Island and Thwaites Glacier
3295,https://svs.gsfc.nasa.gov/3295/,MODIS Mosaic of Antarctica sees the Ross Ice Shelf
3296,https://svs.gsfc.nasa.gov/3296/,Habitat Suitability for Tamarisk Invasion in the State of Utah
